,200DayMovingAverage,50DayMovingAverage,52WeekHigh,52WeekLow,Address,AnalystTargetPrice,AssetType,Beta,BookValue,CIK,Country,Currency,Description,DilutedEPSTTM,DividendDate,DividendPerShare,DividendYield,EBITDA,EPS,EVToEBITDA,EVToRevenue,ExDividendDate,Exchange,FiscalYearEnd,ForwardPE,GrossProfitTTM,Industry,Information,LatestQuarter,MarketCapitalization,Name,Note,OperatingMarginTTM,PEGRatio,PERatio,PriceToBookRatio,PriceToSalesRatioTTM,ProfitMargin,QuarterlyEarningsGrowthYOY,QuarterlyRevenueGrowthYOY,ReturnOnAssetsTTM,ReturnOnEquityTTM,RevenuePerShareTTM,RevenueTTM,Sector,SharesOutstanding,Symbol,TrailingPE
380,28.11,25.96,31.69,24.54,"208 S. AKARD ST, ATTN : JAMES LACY, DALLAS, TX, US",31.12,Common Stock,0.66,22.94,732717,USA,USD,"AT&T Inc. is an American multinational conglomerate holding company, Delaware-registered but headquartered at Whitacre Tower in Downtown Dallas, Texas. It is the world largest telecommunications company, and the second largest provider of mobile telephone services.",0.129,11/1/21,2.08,0.0835,53029999000,0.129,7.67,2.067,10/8/21,NYSE,December,7.67,91840000000.0,TELEPHONE COMMUNICATIONS (NO RADIOTELEPHONE),,9/30/21,178846000000.0,AT&T Inc,,0.18600000000000003,9.96,194.15,1.087,1.03,0.0067,1.114,-0.057,0.0372,0.0137,24.24,173597000000.0,TECHNOLOGY,7141000000,T,194.15
381,276.22,318.14,339.59,149.74,"56 TOP GALLANT RD, P O BOX 10212, STAMFORD, CT, US",358.33,Common Stock,1.56,4.033,749251,USA,USD,"Gartner, Inc, officially known as Gartner, is a global research and advisory firm providing information, advice, and tools for leaders in IT, finance, HR, customer service and support, communications, legal and compliance, marketing, sales, and supply chain functions. Its headquarters are in Stamford, Connecticut, United States.",8.03,None,None,0,1100565000,8.03,23.09,6.51,7/19/99,NYSE,December,32.15,2754379000.0,SERVICES-MANAGEMENT SERVICES,,9/30/21,27306637000.0,Gartner Inc,,0.201,1.99,41.38,81.03,6.01,0.155,8.27,0.163,0.0824,1.026,52.34,4540398000.0,TRADE & SERVICES,82239000,IT,41.38
382,69.83,73.29,78.13,44.13,"40 WESTMINSTER ST, PROVIDENCE, RI, US",83.75,Common Stock,1.752,27.31,217346,USA,USD,"Textron Inc. is an American industrial conglomerate based in Providence, Rhode Island. Textron's subsidiaries include Arctic Cat, Bell Textron, Textron Aviation (which itself includes the Beechcraft, Hawker, and Cessna brands), and Lycoming Engines.",3.4,1/1/22,0.08,0.001,1391000000,3.4,13.39,1.456,12/9/21,NYSE,January,19.42,1591000000.0,AIRCRAFT & PARTS,,10/31/21,16979337000.0,Textron Inc,,0.0784,0.553,22.66,2.807,1.334,0.0609,0.64,0.09300000000000001,0.0401,0.132,56.23,12727000000.0,MANUFACTURING,220425000,TXT,22.66
383,118.73,122.71,135.56,79.6,"1626 EAST JEFFERSON STREET, ROCKVILLE, MD, US",130.47,Common Stock,1.123,29.59,34903,USA,USD,"Federal Realty Investment Trust is a real estate investment trust that invests in shopping centers in the Northeastern United States, the Mid-Atlantic states, California, and South Florida.",3.016,1/18/22,4.25,0.0329,556221000,3.016,21.91,15.64,12/31/21,NYSE,December,53.19,543702000.0,REAL ESTATE INVESTMENT TRUSTS,,9/30/21,10001397000.0,Federal Realty Investment Trust,,0.321,2.563,42.63,4.363,10.93,0.264,4.18,0.203,0.0239,0.0954,11.9,915092000.0,REAL ESTATE & CONSTRUCTION,77790000,FRT,42.63
384,134.35,128.93,142.43,105.39,"1 NEW ORCHARD ROAD, ARMONK, NY, US",148.48,Common Stock,1.102,24.79,51143,USA,USD,"International Business Machines Corporation (IBM) is an American multinational technology company headquartered in Armonk, New York, with operations in over 170 countries. The company began in 1911, founded in Endicott, New York, as the Computing-Tabulating-Recording Company (CTR) and was renamed International Business Machines in 1924. IBM is incorporated in New York. IBM produces and sells computer hardware, middleware and software, and provides hosting and consulting services in areas ranging from mainframe computers to nanotechnology. IBM is also a major research organization, holding the record for most annual U.S. patents generated by a business (as of 2020) for 28 consecutive years. Inventions by IBM include the automated teller machine (ATM), the floppy disk, the hard disk drive, the magnetic stripe card, the relational database, the SQL programming language, the UPC barcode, and dynamic random-access memory (DRAM). The IBM mainframe, exemplified by the System/360, was the dominant computing platform during the 1960s and 1970s.",5.28,12/10/21,6.54,0.0544,15659000000,5.28,12.24,2.132,11/9/21,NYSE,December,10.37,35575000000.0,COMPUTER & OFFICE EQUIPMENT,,9/30/21,106707000000.0,International Business Machines Corporation,,0.12,2.057,22.53,4.852,1.433,0.064,-0.33799999999999997,0.003,0.0374,0.214,83.23,74461004000.0,TECHNOLOGY,896320000,IBM,22.53
385,80.61,80.05,87.7,72.86,"ONE BAXTER PKWY, DF2-1W, DEERFIELD, IL, US",93.79,Common Stock,0.586,17.52,10456,USA,USD,"Baxter International Inc. is an American multinational health care company with headquarters in Deerfield, Illinois. The company primarily focuses on products to treat hemophilia, kidney disease, immune disorders and other chronic and acute medical conditions. ",2.376,10/1/21,1.05,0.0133,2841000000,2.376,17.61,3.439,9/2/21,NYSE,December,19.92,4733000000.0,SURGICAL & MEDICAL INSTRUMENTS & APPARATUS,,9/30/21,39790072000.0,Baxter International Inc,,0.159,1.496,33.45,4.519,3.196,0.0975,0.29,0.085,0.0621,0.141,24.68,12451000000.0,LIFE SCIENCES,500693000,BAX,33.45
386,29.85,29.28,35.53,19.19,"3000 HANOVER ST, MS 1050, PALO ALTO, CA, US",33.05,Common Stock,1.046,-0.763,47217,USA,USD,"HP Inc. is an American multinational information technology company headquartered in Palo Alto, California, that develops personal computers (PCs), printers and related supplies, as well as 3D printing solutions.",3.1919999999999997,10/6/21,0.758,0.0239,6052000000,3.1919999999999997,7.17,0.667,9/7/21,NYSE,October,7.94,10437000000.0,COMPUTER & OFFICE EQUIPMENT,,7/31/21,36673184000.0,HP Inc,,0.0849,0.791,9.97,-,0.591,0.0656,0.7759999999999999,0.07,0.0944,-99999.99,49.15,62070002000.0,TECHNOLOGY,1152520000,HPQ,9.97
387,51.12,54.32,58.58,33.96,"500 WEST MADISON STREET, SUITE 2800, CHICAGO, IL, US",65.89,Common Stock,1.618,20.2,1065696,USA,USD,LKQ Corporation (Like Kind and Quality) is an American provider of alternative and speciality parts to repair and accessorise automobiles and other vehicles.,3.4360000000000004,12/2/21,1,0.0173,1781287000,3.4360000000000004,11.59,1.571,11/9/21,NASDAQ,December,15.11,4600412000.0,WHOLESALE-MOTOR VEHICLES & MOTOR VEHICLE PARTS & SUPPLIES,,9/30/21,16998298000.0,LKQ Corporation,,0.11599999999999999,1.14,16.97,2.851,1.3219999999999998,0.0806,0.51,0.08199999999999999,0.0757,0.182,42.8,12856399000.0,TRADE & SERVICES,291491000,LKQ,16.97
388,85.28,84.84,90.95,77.16,"500 CHARLES EWING BOULEVARD, EWING, NJ, US",90.38,Common Stock,0.395,14.34,313927,USA,USD,"Church & Dwight Co., Inc., is a major American manufacturer of household products that is headquartered in Ewing, New Jersey.",3.278,12/1/21,0.998,0.0111,1164200000,3.278,18.38,4.727,11/12/21,NYSE,December,27.86,2214200000.0,"SOAP, DETERGENTS, CLEANG PREPARATIONS, PERFUMES, COSMETICS",,9/30/21,22622800000.0,Church & Dwight Co. Inc,,0.19,4.122,27.61,6.42,4.421,0.16,0.08199999999999999,0.057,0.0841,0.244,20.81,5116700000.0,LIFE SCIENCES,250000000,CHD,27.61
389,109.7,111.66,125.42,72.43,"200 MADISON AVENUE, NEW YORK, NY, US",129.89,Common Stock,2.286,70.45,78239,USA,USD,"PVH Corp., formerly known as the Phillips-Van Heusen Corporation, is an American clothing company which owns brands such as Van Heusen, Tommy Hilfiger, Calvin Klein, IZOD, Arrow, Warner's, Olga, True & Co., and Geoffrey Beene.",4.081,12/17/21,0,0,979600000,4.081,12.71,1.405,11/23/21,NYSE,February,12.3,3776800000.0,"MEN'S & BOYS' FURNISHGS, WORK CLOTHG, & ALLIED GARMENTS",,8/31/21,8542522000.0,PVH Corp,,0.0777,4.584,29.46,1.72,0.993,0.0342,-0.652,0.46299999999999997,0.0321,0.0609,120.71,8600400000.0,MANUFACTURING,71052000,PVH,29.46
390,89.11,101.83,127.75,64.92,"9348 CIVIC CENTER DRIVE, BEVERLY HILLS, CA, US",110.67,Common Stock,1.291,5.39,1335258,USA,USD,"Live Nation Entertainment, Inc is an American global entertainment company, founded in 2010, following the merger of Live Nation and Ticketmaster. The company promotes, operates, and manages ticket sales for live entertainment in the United States and internationally. It also owns and operates entertainment venues, and manages the careers of music artists.",-4.165,None,None,0,657285000,-4.165,18.29,7.45,None,NYSE,December,312.5,458778000.0,SERVICES-AMUSEMENT & RECREATION SERVICES,,9/30/21,25233811000.0,Live Nation Entertainment Inc,,-0.184,2.65,None,31.01,6.64,-0.23600000000000002,0.011000000000000001,13.67,-0.0361,-2.412,17.67,3802660000.0,TRADE & SERVICES,224660000,LYV,-
391,798.06,796.87,885.26,582.34,"ONE LAGOON DRIVE, REDWOOD CITY, CA, US",890.04,Common Stock,0.338,117.38,1101239,USA,USD,"Equinix, Inc. is an American multinational company headquartered in Redwood City, California, that specializes in Internet connection and data centers.",4.743,12/15/21,11.27,0.0145,2775003000,4.743,33.49,12.85,11/16/21,NASDAQ,December,90.09,2888768000.0,REAL ESTATE INVESTMENT TRUSTS,,9/30/21,69916991000.0,Equinix Inc. (REIT),,0.177,3.818,163.72,6.6,10.69,0.0654,1.27,0.11199999999999999,0.0268,0.0405,73.11,6542705000.0,REAL ESTATE & CONSTRUCTION,90041000,EQIX,163.72
392,415.18,428.33,466.0,316.94,"UNITEDHEALTH GROUP CENTER, 9900 BREN ROAD EAST, MINNEAPOLIS, MN, US",474.55,Common Stock,0.85,74.61,731766,USA,USD,"UnitedHealth Group Incorporated is an American for-profit multinational managed healthcare and insurance company based in Minnetonka, Minnesota. It offers health care products and insurance services. In 2020, it was the second-largest healthcare company (behind CVS Health) by revenue with $257.1 billion, and the largest insurance company by net premiums. UnitedHealthcare revenues comprise 80% of the Group's overall revenue.",16.11,12/14/21,5.4,0.0118,24196000000,16.11,18.15,1.636,12/3/21,NYSE,December,21.19,67000000000.0,HOSPITAL & MEDICAL SERVICE PLANS,,9/30/21,432300000000.0,UnitedHealth Group Incorporated,,0.0786,1.677,28.49,6.13,1.548,0.0552,0.297,0.111,0.0679,0.22,295.5,279321000000.0,FINANCE,941851000,UNH,28.49
393,132.79,127.45,142.54,111.81,"488 8TH AVENUE, P O BOX 129400, SAN DIEGO, CA, US",147.26,Common Stock,0.652,74.19,1032208,USA,USD,"Sempra Energy is a North American energy infrastructure company based in San Diego, California. Sempra Energy's focus is on electric and natural gas infrastructure. Its operating companies include: Southern California Gas Company (SoCalGas) and San Diego Gas & Electric (SDG&E) in Southern California; Oncor Electric Delivery Company (Oncor) in Texas; Sempra LNG; and IEnova, based in Mexico.",3.486,10/15/21,4.34,0.0357,4351000000,3.486,22.01,5.33,9/23/21,NYSE,December,14.31,4499000000.0,GAS & OTHER SERVICES COMBINED,,9/30/21,38991045000.0,Sempra,,0.21,2.216,35.03,1.639,3.2,0.0955,-0.82,0.14,0.0232,0.0478,40.05,12184001000.0,ENERGY & TRANSPORTATION,319337000,SRE,35.03
394,122.16,123.43,135.17,73.1,"2500 LAKE COOK ROAD, RIVERWOODS, IL, US",141.21,Common Stock,1.713,41.41,1393612,USA,USD,"Discover Financial Services is an American financial services company that owns and operates Discover Bank, which offers checking and savings accounts, personal loans, home equity loans, student loans and credit cards. It also owns and operates the Discover and Pulse networks, and owns Diners Club International. Discover is currently headquartered in the Chicago suburb of Riverwoods, Illinois.",16.72,12/9/21,1.82,0.0154,None,16.72,-,-,11/23/21,NYSE,December,8.9,5414000000.0,PERSONAL CREDIT INSTITUTIONS,,9/30/21,34780795000.0,Discover Financial Services,,0.601,0.397,7.1,2.845,3.0269999999999997,0.451,0.445,0.32,0.0445,0.441,37.79,11489000000.0,FINANCE,293076000,DFS,7.1
395,72.3,77.31,84.38,58.21,"358 HALL AVE, WALLINGFORD, CT, US",82.43,Common Stock,1.248,9.95,820313,USA,USD,"Amphenol Corporation is a major producer of electronic and fiber optic connectors, cable and interconnect systems such as coaxial cables. Amphenol is a portmanteau from the corporation's original name, American Phenolic Corp.",2.38,1/12/22,0.58,0.007,2425200000,2.38,22.61,5.2,12/20/21,NYSE,December,30.12,2664100000.0,ELECTRONIC CONNECTORS,,9/30/21,50198475000.0,Amphenol Corporation,,0.201,2.061,35.27,8.33,4.885,0.14400000000000002,0.218,0.213,0.0965,0.267,17.18,10275500000.0,MANUFACTURING,598028000,APH,35.27
396,81.07,84.1,88.08,54.22,"EQUITY RESIDENTIAL, TWO NORTH RIVERSIDE PLAZA, SUITE 400, CHICAGO, IL, US",89.23,Common Stock,0.799,28.33,906107,USA,USD,Equity Residential is a publicly traded real estate investment trust that invests in apartments.,2.823,10/8/21,2.41,0.028,1441041000,2.823,18.28,16.66,9/24/21,NYSE,December,74.07,1655320000.0,REAL ESTATE INVESTMENT TRUSTS,,9/30/21,32416383000.0,Equity Residential,,0.256,4.696,30.62,3.017,13.33,0.435,3.718,0.001,0.0189,0.0982,6.52,2432302000.0,REAL ESTATE & CONSTRUCTION,375016000,EQR,30.62
397,19.04,18.91,23.0,13.37,"1020 HULL STREET, 3RD FLOOR, BALTIMORE, MD, US",26.2,Common Stock,1.285,4.154,1336917,USA,USD,"Under Armour, Inc. is an American sports equipment company that manufactures footwear, sports and casual apparel. Under Armour's global headquarters are located in Baltimore, Maryland.",0.945,None,None,0,691838000,0.945,44.7,2.007,None,NYSE,December,33,2172471000.0,APPAREL & OTHER FINISHD PRODS OF FABRICS & SIMILAR MATL,,9/30/21,10944011000.0,Under Armour Inc,,0.0977,4.461,22.51,5.09,1.969,0.0782,1.801,0.079,0.0701,0.252,12.08,5558027000.0,MANUFACTURING,253019000,UA,22.51
398,61.4,55.63,74.04,52.75,"6363 SOUTH FIDDLERS GREEN CIRCLE, GREENWOOD VILLAGE, CO, US",99.78,Common Stock,0.235,28.46,1164727,USA,USD,"Newmont Corporation, based in Greenwood Village, Colorado, United States, is one of the largest gold mining companies in the world.",2.537,12/28/21,2.2,0.0374,6045000000,2.537,9.43,3.961,12/8/21,NYSE,December,21.19,6159000000.0,GOLD AND SILVER ORES,,9/30/21,46833357000.0,Newmont Corporation,,0.304,0.787,23.15,2.066,3.835,0.16699999999999998,-0.996,-0.087,0.0578,0.0725,15.25,12213000000.0,ENERGY & TRANSPORTATION,797435000,NEM,23.15
399,138.32,135.95,169.52,121.8,"5775 MOREHOUSE DR, SAN DIEGO, CA, US",187.39,Common Stock,1.331,8.84,804328,USA,USD,"Qualcomm is an American multinational corporation headquartered in San Diego, California, and incorporated in Delaware. It creates semiconductors, software, and services related to wireless technology. It owns patents critical to the 5G, 4G, CDMA2000, TD-SCDMA and WCDMA mobile communications standards.",7.87,12/16/21,2.66,0.0162,11371000000,7.87,15.1,5.59,12/1/21,NASDAQ,September,15.55,19304000000.0,RADIO & TV BROADCASTING & COMMUNICATIONS EQUIPMENT,,9/30/21,184733000000.0,QUALCOMM Incorporated,,0.292,1.053,20.96,18.51,5.5,0.26899999999999996,-0.049,0.11900000000000001,0.159,1.129,29.68,33565999000.0,MANUFACTURING,1120000000,QCOM,20.96
400,218.36,216.37,238.87,172.47,"100 MISSION RIDGE, GOODLETTSVILLE, TN, US",249.88,Common Stock,0.501,26.3,29534,USA,USD,"Dollar General Corporation is an American chain of variety stores headquartered in Goodlettsville, Tennessee.",10.43,10/19/21,1.56,0.007,4014774000,10.43,16.27,1.938,10/4/21,NYSE,January,20.04,10718862000.0,RETAIL-VARIETY STORES,,7/31/21,52389761000.0,Dollar General Corporation,,0.10099999999999999,2.294,21.53,8.41,1.556,0.0752,-0.138,-0.004,0.083,0.375,139.68,33665311000.0,TRADE & SERVICES,233310000,DG,21.53
401,331.79,355.16,419.33,233.9,"ONE TECHNOLOGY DRIVE, MILPITAS, CA, US",410.25,Common Stock,1.224,25.44,319201,USA,USD,"KLA Corporation is a capital equipment company based in Milpitas, California. It supplies process control and yield management systems for the semiconductor industry and other related nanoelectronics industries. The company's products and services are intended for all phases of wafer, reticle, integrated circuit (IC) and packaging production, from research and development to final volume manufacturing.",17.62,12/1/21,3.75,0.0091,3113245000,17.62,20.24,8.51,11/12/21,NASDAQ,June,19.76,4146569000.0,OPTICAL INSTRUMENTS & LENSES,,9/30/21,63227892000.0,KLA Corporation,,0.37200000000000005,1.774,23.67,16.21,8.47,0.365,1.587,0.354,0.17,0.823,48.67,7463952000.0,LIFE SCIENCES,151622000,KLAC,23.67
402,366.74,349.21,392.88,312.98,"6801 ROCKLEDGE DR, BETHESDA, MD, US",386.61,Common Stock,0.931,35.15,936468,USA,USD,"Lockheed Martin Corporation is an American aerospace, defense, information security, and technology company with worldwide interests. It is headquartered in North Bethesda, Maryland, in the Washington, D.C., area.",21.71,12/27/21,10.4,0.031,8777000000,21.71,11.06,1.531,11/30/21,NYSE,December,12.25,8681000000.0,GUIDED MISSILES & SPACE VEHICLES & PARTS,,9/30/21,93507994000.0,Lockheed Martin Corporation,,0.114,8.4,15.62,9.62,1.409,0.0913,-0.635,-0.027999999999999997,0.0924,0.8290000000000001,238.62,66347000000.0,MANUFACTURING,275786000,LMT,15.62
403,155.37,160.47,174.48,111.58,"30 PEMBROKE ROAD, EATON HOUSE, DUBLIN, IE",179.9,Common Stock,1.189,40.07,1551182,USA,USD,"Eaton Corporation plc is an American Irish-domiciled multinational power management company with 2020 sales of 17.86 billion USD, founded in the United States with corporate headquarters in Dublin, Ireland, and operational headquarters in Beachwood, Ohio.",5.15,11/30/21,3.01,0.0177,3323000000,5.15,19.79,3.918,11/10/21,NYSE,December,23.2,5450000000.0,MISC INDUSTRIAL & COMMERCIAL MACHINERY & EQUIPMENT,,9/30/21,68619624000.0,Eaton Corporation plc,,0.125,1.748,33.41,4.241,3.516,0.106,0.414,0.08800000000000001,0.0467,0.136,48.95,19517000000.0,TECHNOLOGY,398600000,ETN,33.41
404,135.86,137.26,146.29,99.41,"155 NORTH LAKE AVENUE, PASADENA, CA, US",155.77,Common Stock,0.847,47.22,52988,USA,USD,"Jacobs Engineering Group Inc. (NYSE: J) is an American international technical professional services firm. The company provides technical, professional and construction services, as well as scientific and specialty consulting for a broad range of clients globally, including companies, organizations, and government agencies.",3.503,10/29/21,0.8,0.0055,1184020000,3.503,24.52,1.534,10/14/21,NYSE,September,20.7,2588981000.0,HEAVY CONSTRUCTION OTHER THAN BLDG CONST - CONTRACTORS,,6/30/21,18950261000.0,Jacobs Engineering Group Inc,,0.0688,1.399,41.51,3.063,1.351,0.0368,-0.5579999999999999,0.09699999999999999,0.0434,0.0678,107.73,14025833000.0,REAL ESTATE & CONSTRUCTION,130314000,J,41.51
405,43.51,43.37,46.29,32.99,"300 BOSTON SCIENTIFIC WAY, MARLBOROUGH, MA, US",51.2,Common Stock,0.829,11.55,885725,USA,USD,"Boston Scientific Corporation, doing business as Boston Scientific, is a manufacturer of medical devices used in interventional medical specialties, including interventional radiology, interventional cardiology, peripheral interventions, neuromodulation, neurovascular intervention, electrophysiology, cardiac surgery, vascular surgery, endoscopy, oncology, urology and gynecology.",0.769,None,None,0,3071000000,0.769,24.87,5.87,None,NYSE,December,22.68,6793000000.0,SURGICAL & MEDICAL INSTRUMENTS & APPARATUS,,9/30/21,60170199000.0,Boston Scientific Corporation,,0.172,1.541,54.91,3.632,5.25,0.10099999999999999,28.22,0.10300000000000001,0.0394,0.0722,8.06,11470000000.0,LIFE SCIENCES,1424990000,BSX,54.91
406,3390.63,3366.62,3773.08,2881.0,"410 TERRY AVENUE NORTH, SEATTLE, WA, US",4066.41,Common Stock,1.114,237.8,1018724,USA,USD,"Amazon.com, Inc. is an American multinational technology company which focuses on e-commerce, cloud computing, digital streaming, and artificial intelligence. It is one of the Big Five companies in the U.S. information technology industry, along with Google, Apple, Microsoft, and Facebook. The company has been referred to as one of the most influential economic and cultural forces in the world, as well as the world's most valuable brand.",51.1,None,None,0,60403999000,51.1,27.7,3.922,None,NASDAQ,December,54.05,152757000000.0,RETAIL-CATALOG & MAIL-ORDER HOUSES,,9/30/21,1784260000000.0,Amazon.com Inc,,0.0618,2.067,68.85,14.61,3.8960000000000004,0.0574,-0.505,0.153,0.0532,0.258,909.11,457965000000.0,TRADE & SERVICES,507148000,AMZN,68.85
407,554.84,639.75,690.97,475.84,"100 WINCHESTER CIRCLE, ., LOS GATOS, CA, US",667.4,Common Stock,0.813,34.57,1065280,USA,USD,"Netflix, Inc. is an American over-the-top content platform and production company headquartered in Los Gatos, California. Netflix was founded in 1997 by Reed Hastings and Marc Randolph in Scotts Valley, California. The company's primary business is a subscription-based streaming service offering online streaming from a library of films and television series, including those produced in-house.",11.09,None,None,0,6693352000,11.09,16.2,10.45,None,NASDAQ,December,50.76,9719737000.0,SERVICES-VIDEO TAPE RENTAL,,9/30/21,302363000000.0,Netflix Inc,,0.228,1.606,61.55,19.02,10.56,0.17600000000000002,0.833,0.163,0.1,0.39399999999999996,64.66,28632967000.0,TRADE & SERVICES,442952000,NFLX,61.55
408,483.96,514.05,565.74,362.45,"1320 RIDDER PARK DRIVE, SAN JOSE, CA, US",573.37,Common Stock,0.955,59.08,1730168,USA,USD,"Broadcom Inc. is an American designer, developer, manufacturer and global supplier of a wide range of semiconductor and infrastructure software products. Broadcom's product offerings serve the data center, networking, software, broadband, wireless, and storage and industrial markets.",13.49,9/30/21,14.4,0.0259,13926000000,13.49,18.6,9.73,9/21/21,NASDAQ,October,18.18,17370000000.0,SEMICONDUCTORS & RELATED DEVICES,,7/31/21,231830000000.0,Broadcom Inc,,0.28800000000000003,1.269,41.74,9.39,8.74,0.22899999999999998,1.881,0.16399999999999998,0.0616,0.253,64.97,26510000000.0,MANUFACTURING,411616000,AVGO,41.74
409,701.61,748.07,832.7,507.22,"1000 ALFRED NOBEL DRIVE, HERCULES, CA, US",918.75,Common Stock,0.87,512.48,12208,USA,USD,"Bio-Rad Laboratories, Inc. is an American developer and manufacturer of specialized technological products for the life science research and clinical diagnostics markets.",220.48,None,None,0,758890000,220.48,2.441,7.12,None,NYSE,December,49.26,1435922000.0,LABORATORY ANALYTICAL INSTRUMENTS,,9/30/21,22464391000.0,Bio-Rad Laboratories Inc,,0.209,3.55,3.43,1.468,7.54,2.235,1.9780000000000002,0.154,0.0243,0.551,99.96,2979615000.0,LIFE SCIENCES,24836100,BIO,3.43
410,226.97,209.18,270.48,188.45,"900 COTTAGE GROVE ROAD, BLOOMFIELD, CT, US",262.08,Common Stock,0.871,143.07,1739940,USA,USD,"Cigna is an American multinational managed healthcare and insurance company based in Bloomfield, Connecticut. Its insurance subsidiaries are major providers of medical, dental, disability, life and accident insurance and related products and services, the majority of which are offered through employers and other groups (e.g. governmental and non-governmental organizations, unions and associations).",24.03,12/22/21,3,0.0138,10155000000,24.03,-,0.604,12/6/21,NYSE,December,9.76,24356000000.0,HOSPITAL & MEDICAL SERVICE PLANS,,9/30/21,72161821000.0,Cigna Corporation,,0.0485,0.872,9.06,1.522,0.423,0.0492,0.27,0.08199999999999999,0.0329,0.17600000000000002,493.03,170397000000.0,FINANCE,331428000,CI,9.06
411,67.51,72.55,77.57,40.12,"150 N RADNOR CHESTER RD, RADNOR, PA, US",76.09,Common Stock,2.141,113.76,59558,USA,USD,"Lincoln National Corporation is an American holding company, which operates multiple insurance and investment management businesses through subsidiary companies. Lincoln Financial Group is the marketing name for LNC and its subsidiary companies.",6.97,2/1/22,1.68,0.0229,1917000000,6.97,-,0.923,1/7/22,NYSE,December,6.48,3812000000.0,LIFE INSURANCE,,9/30/21,13196275000.0,Lincoln National Corporation,,0.0992,1.24,10.47,0.626,0.7040000000000001,0.0708,-0.165,-0.022000000000000002,0.0032,0.0622,98.51,18763000000.0,FINANCE,180709000,LNC,10.47
412,50.78,53.6,59.56,40.63,"222 EAST ERIE STREET, STE 500, MILWAUKEE, WI, US",63.36,Common Stock,1.491,21.23,1699150,USA,USD,"Ingersoll Rand Inc., founded in 1859, is an American worldwide provider of industrial equipment, technologies and related parts and services to a broad and diverse customer base through a family of brands.",0.987,12/17/21,2.12,0.0364,1163500000,0.987,22.6,4.28,11/9/21,NYSE,December,25.77,1613400000.0,GENERAL INDUSTRIAL MACHINERY & EQUIPMENT,,9/30/21,23823344000.0,Ingersoll Rand Inc,,0.11,1.63,59.22,2.744,4.045,0.0715,3.3,0.191,0.0265,0.0559,14.11,5889100000.0,TECHNOLOGY,407585000,IR,59.22
413,56.77,54.28,61.53,47.52,"ONE COMCAST CENTER, PHILADELPHIA, PA, US",65.49,Common Stock,0.968,20.96,1166691,USA,USD,"Comcast Corporation is an American telecommunications conglomerate headquartered in Philadelphia, Pennsylvania. It is the second-largest broadcasting and cable television company in the world by revenue (behind AT&T), the largest pay-TV company, the largest cable TV company and largest home Internet service provider in the United States, and the nation's third-largest home telephone service provider. Comcast provides services to U.S. residential and commercial customers in 40 states and in the District of Columbia. As the parent company of the international media company NBCUniversal since 2011, Comcast is a producer of feature films and television programs intended for theatrical exhibition and over-the-air and cable television broadcast, respectively.",3.109,1/26/22,0.98,0.0183,33387999000,3.109,8.86,2.906,1/4/22,NASDAQ,December,14.39,70443000000.0,CABLE & OTHER PAY TELEVISION SERVICES,,9/30/21,244437000000.0,Comcast Corporation,,0.175,1.521,17.21,2.56,2.149,0.127,0.955,0.187,0.0456,0.153,24.78,113757000000.0,TECHNOLOGY,4559480000,CMCSA,17.21
