,200DayMovingAverage,50DayMovingAverage,52WeekHigh,52WeekLow,Address,AnalystTargetPrice,AssetType,Beta,BookValue,CIK,Country,Currency,Description,DilutedEPSTTM,DividendDate,DividendPerShare,DividendYield,EBITDA,EPS,EVToEBITDA,EVToRevenue,ExDividendDate,Exchange,FiscalYearEnd,ForwardPE,GrossProfitTTM,Industry,Information,LatestQuarter,MarketCapitalization,Name,Note,OperatingMarginTTM,PEGRatio,PERatio,PriceToBookRatio,PriceToSalesRatioTTM,ProfitMargin,QuarterlyEarningsGrowthYOY,QuarterlyRevenueGrowthYOY,ReturnOnAssetsTTM,ReturnOnEquityTTM,RevenuePerShareTTM,RevenueTTM,Sector,SharesOutstanding,Symbol,TrailingPE
227,59.63,62.55,65.65,34.44,"5959 LAS COLINAS BLVD, IRVING, TX, US",70.91,Common Stock,1.343,37.93,34088,USA,USD,"Exxon Mobil Corporation, stylized as ExxonMobil, is an American multinational oil and gas corporation headquartered in Irving, Texas. It is the largest direct descendant of John D. Rockefeller's Standard Oil, and was formed on November 30, 1999 by the merger of Exxon (formerly the Standard Oil Company of New Jersey) and Mobil (formerly the Standard Oil Company of New York). ExxonMobil's primary brands are Exxon, Mobil, Esso, and ExxonMobil Chemical. ExxonMobil is incorporated in New Jersey.",-1.386,12/10/21,3.48,0.0541,33627001000,-1.386,8.27,1.344,11/10/21,NYSE,December,11.2,57157000000.0,PETROLEUM REFINING,,9/30/21,269255000000.0,Exxon Mobil Corporation,,0.0572,2.524,None,1.695,1.111,-0.0243,-0.49200000000000005,0.578,0.025,-0.0346,56.68,242299000000.0,ENERGY & TRANSPORTATION,4233540000,XOM,-
228,230.58,223.17,251.88,191.63,"P.O. BOX 8999, SAN FRANCISCO, CA, UNITED STATES",275.42,Common Stock,0.917,16.32,1403161,USA,USD,"Visa Inc. is an American multinational financial services corporation headquartered in Foster City, California, United States. It facilitates electronic funds transfers throughout the world, most commonly through Visa-branded credit cards, debit cards and prepaid cards. Visa is one of the world's most valuable companies.",5.63,12/7/21,1.335,0.0063,16611000000,5.63,26.75,19.29,11/10/21,NYSE,September,29.5,23375000000.0,"SERVICES-BUSINESS SERVICES, NEC",,9/30/21,462973000000.0,Visa Inc,,0.6559999999999999,1.573,37.67,13.31,19.21,0.511,0.705,0.28600000000000003,0.121,0.33399999999999996,11.32,24105001000.0,TRADE & SERVICES,1677000000,V,37.67
229,97.76,109.63,120.83,59.47,"2884 SAND HILL RD, STE 200, MENLO PARK, CA, US",104.67,Common Stock,1.586,12.02,315213,USA,USD,"Robert Half International, or commonly referred as, Robert Half, is a global human resource consulting firm based in Menlo Park, California.",4.678,12/15/21,1.48,0.0126,690063000,4.678,18.44,2.123,11/23/21,NYSE,December,21.93,2012611000.0,SERVICES-HELP SUPPLY SERVICES,,9/30/21,13011138000.0,Robert Half International Inc,,0.105,1.453,24.98,9.95,2.17,0.0876,1.284,0.439,0.14400000000000002,0.418,53.95,5995613000.0,TRADE & SERVICES,111330000,RHI,24.98
230,154.76,145.51,179.81,130.26,"345 EAST MAIN STREET, WARSAW, IN, US",170.76,Common Stock,1.207,60.84,1136869,USA,USD,"Zimmer Biomet is a publicly traded medical device company. The company is headquartered in Warsaw, Indiana, where it is part of the medical devices business cluster.",3.9139999999999997,10/29/21,0.96,0.0072,2380100000,3.9139999999999997,16.89,4.353,9/29/21,NYSE,December,16.58,4896200000.0,"ORTHOPEDIC, PROSTHETIC & SURGICAL APPLIANCES & SUPPLIES",,9/30/21,27655242000.0,Zimmer Biomet Holdings Inc,,0.16699999999999998,1.342,33.82,2.181,3.508,0.10400000000000001,-0.405,-0.003,0.0342,0.0667,37.85,7883600000.0,LIFE SCIENCES,208908000,ZBH,33.82
231,133.81,130.71,143.22,106.46,"1100 CASSATT ROAD, BERWYN, PA, US",161.16,Common Stock,1.317,28.35,1037868,USA,USD,"AMETEK, Inc. is an American global manufacturer of electronic instruments and electromechanical devices with a headquarters in the United States and over 220 manufacturing sites worldwide.",3.99,12/24/21,0.78,0.0056,1502160000,3.99,22.75,6.59,12/7/21,NYSE,December,28.25,1587214000.0,"INDUSTRIAL INSTRUMENTS FOR MEASUREMENT, DISPLAY, AND CONTROL",,9/30/21,32346173000.0,AMETEK Inc,,0.233,2.08,35.05,4.893,6.17,0.177,0.25,0.278,0.0691,0.152,22.73,5241716000.0,LIFE SCIENCES,231325000,AME,35.05
232,246.87,249.56,265.34,165.52,"4820 EMPEROR BLVD., DURHAM, NC, US",288.22,Common Stock,1.403,30.5,1478242,USA,USD,"IQVIA, formerly Quintiles and IMS Health, Inc., is an American multinational company serving the combined industries of health information technology and clinical research. It is a provider of biopharmaceutical development and commercial outsourcing services, focused primarily on Phase I-IV clinical trials and associated laboratory and analytical services, including consulting services.",3.929,None,None,0,2342000000,3.929,22.09,4.372,None,NYSE,December,25.13,3859000000.0,SERVICES-COMMERCIAL PHYSICAL & BIOLOGICAL RESEARCH,,9/30/21,48386609000.0,IQVIA Holdings Inc,,0.0933,0.974,64.46,8.28,3.575,0.0567,1.577,0.217,0.033,0.131,70.7,13536000000.0,TRADE & SERVICES,191040000,IQV,64.46
233,61.62,68.36,77.44,27.0,"THREE LIMITED PKWY, P O BOX 16000, COLUMBUS, OH, US",82.22,Common Stock,1.738,None,701985,USA,USD,None,6.49,12/3/21,0.15,0.002,3573000000,6.49,7.96,1.893,11/18/21,NYSE,January,17.18,5607000000.0,RETAIL-WOMEN'S CLOTHING STORES,,7/31/21,19648201000.0,Bath Body Works Inc,,0.215,1.465,11.45,-,1.382,0.13,0.0,0.431,0.18,0.0,51.13,14214000000.0,TRADE & SERVICES,264373000,BBWI,11.45
234,28.62,23.5,37.31,18.78,"TWO FOLSOM STREET, SAN FRANCISCO, CA, US",32.3,Common Stock,1.666,8.03,39911,USA,USD,"The Gap, Inc., commonly known as Gap Inc. or Gap, is an American worldwide clothing and accessories retailer.",1.974,1/26/22,0.12,0.0048,1350000000,1.974,9.62,0.844,1/4/22,NYSE,January,10.64,6080000000.0,RETAIL-FAMILY CLOTHING STORES,,7/31/21,9334925000.0,The Gap Inc,,0.0514,4.149,12.57,3.108,0.562,0.0453,-0.324,0.28600000000000003,0.0389,0.28600000000000003,44.2,16620000000.0,TRADE & SERVICES,376105000,GPS,12.57
235,23.66,23.68,26.09,16.9,"1211 AVENUE OF THE AMERICAS, NEW YORK, NY, US",32.6,Common Stock,1.385,13.85,1564708,USA,USD,"News Corporation is an American mass media and publishing company operating across digital real estate information, news media, book publishing, and cable television.",0.83,10/13/21,0.2,0.0085,1178000000,0.83,10.5,1.577,9/14/21,NASDAQ,June,31.06,4579000000.0,NEWSPAPERS: PUBLISHING OR PUBLISHING & PRINTING,,9/30/21,14081808000.0,News Corporation,,0.0767,2.369,28.6,1.702,1.445,0.0505,4.7219999999999995,0.182,0.0303,0.0692,16.49,9743000000.0,MANUFACTURING,199630000,NWS,28.6
236,32.81,33.58,36.45,27.47,"500 WATER STREET, 15TH FLOOR, JACKSONVILLE, FL, US",37.84,Common Stock,1.233,5.93,277948,USA,USD,"CSX Corporation is an American holding company focused on rail transportation and real estate in North America, among other industries. Based in Richmond, Virginia, USA after the merger, in 2003 the CSX Corporation headquarters moved to Jacksonville, Florida.",1.589,12/15/21,0.365,0.0104,6523000000,1.589,13.46,7.77,11/29/21,NASDAQ,December,19.84,5795000000.0,"RAILROADS, LINE-HAUL OPERATING",,9/30/21,78139433000.0,CSX Corporation,,0.429,1.636,22.17,5.92,6.56,0.303,0.344,0.243,0.0804,0.27899999999999997,5.25,11920000000.0,ENERGY & TRANSPORTATION,2217980000,CSX,22.17
237,440.49,408.61,526.0,292.65,"5200 ILLUMINA WAY, SAN DIEGO, CA, US",438.69,Common Stock,0.86,67.47,1110803,USA,USD,"Illumina, Inc. is an American company. Incorporated on April 1, 1998, Illumina develops, manufactures, and markets integrated systems for the analysis of genetic variation and biological function. The company provides a line of products and services that serves the sequencing, genotyping and gene expression, and proteomics markets. Its headquarters are located in San Diego, California.",6.11,None,None,0,918000000,6.11,44.77,14.36,None,NASDAQ,December,91.74,2231000000.0,LABORATORY ANALYTICAL INSTRUMENTS,,9/30/21,60309918000.0,Illumina Inc,,0.165,2.948,63.16,5.68,14.09,0.212,0.7190000000000001,0.395,0.0393,0.11900000000000001,28.97,4280000000.0,LIFE SCIENCES,156300000,ILMN,63.16
238,166.59,165.82,179.5,140.42,"PO BOX 807, 663 HWY 60, MONETT, MO, US",178.71,Common Stock,0.591,18.85,779152,USA,USD,"Jack Henry & Associates, Inc. is a technology company and payment processing service for the financial services industry.",4.302,9/29/21,1.81,0.0114,467786000,4.302,20.55,6.72,9/8/21,NASDAQ,June,34.72,694826000.0,SERVICES-COMPUTER INTEGRATED SYSTEMS DESIGN,,9/30/21,11679228000.0,Jack Henry & Associates Inc,,0.231,2.882,36.67,8.93,6.51,0.18,0.159,0.08,0.11199999999999999,0.21899999999999997,23.95,1794481000.0,TECHNOLOGY,73999000,JKHY,36.67
239,155.9,165.39,180.81,111.02,"5 HANOVER QUAY, GRAND CANAL DOCK, DUBLIN, IE",183.92,Common Stock,2.065,30.66,1521332,USA,USD,"Aptiv plc is an auto parts company headquartered in Dublin, Ireland.",2.9410000000000003,2/19/20,0,0,2178000000,2.9410000000000003,21.8,3.019,2/4/20,NYSE,December,34.72,1950000000.0,MOTOR VEHICLE PARTS & ACCESSORIES,,9/30/21,46887432000.0,Aptiv PLC,,0.08900000000000001,1.498,58.11,5.51,2.987,0.0547,-0.6970000000000001,-0.004,0.0512,0.11,58.06,15696000000.0,MANUFACTURING,270514000,APTV,58.11
240,42.74,42.43,47.05,28.53,"9601 S. MERIDIAN BLVD., ENGLEWOOD, CO, US",50.83,Common Stock,2.058,28.28,1001082,USA,USD,"DISH Network Corporation is an American television provider and the owner of the direct-broadcast satellite provider DISH, commonly known as DISH Network, and the over-the-top IPTV service, Sling TV.",4.159,12/28/12,None,0,4229249000,4.159,7.29,1.721,12/12/12,NASDAQ,December,11.71,5459707000.0,CABLE & OTHER PAY TELEVISION SERVICES,,9/30/21,19322061000.0,DISH Network Corporation,,0.193,1.46,8.79,1.283,1.074,0.14400000000000002,0.023,-0.018000000000000002,0.0562,0.185,34.13,17991813000.0,TECHNOLOGY,290357000,DISH,8.79
241,427.05,515.21,558.97,302.44,"7501 W. MEMORIAL ROAD, OKLAHOMA CITY, OK, US",562.63,Common Stock,1.395,14.23,1590955,USA,USD,"Paycom Software, Inc., known simply as Paycom, is an American online payroll and human resource technology provider based in Oklahoma City, Oklahoma.",2.95,None,None,0,256642000,2.95,102.04,29.34,None,NYSE,December,86.96,743656000.0,SERVICES-PREPACKAGED SOFTWARE,,9/30/21,29480276000.0,Paycom Software Inc,,0.223,3.058,165.27,35.49,29.73,0.17300000000000001,0.106,0.304,0.0413,0.235,17.16,991485000.0,TECHNOLOGY,60026000,PAYC,165.27
242,164.96,155.64,181.65,130.75,"ONE PPG PL 40 EAST, PITTSBURGH, PA, US",177.3,Common Stock,1.149,26.34,79879,USA,USD,"PPG Industries, Inc. is an American Fortune 500 company and global supplier of paints, coatings, and specialty materials. With headquarters in Pittsburgh, Pennsylvania, PPG operates in more than 70 countries around the globe.",5.95,12/10/21,2.21,0.0139,2511000000,5.95,17.45,2.704,11/9/21,NYSE,December,19.34,6091000000.0,"PAINTS, VARNISHES, LACQUERS, ENAMELS & ALLIED PRODS",,9/30/21,38190694000.0,PPG Industries Inc,,0.121,2.261,27.03,6.06,2.333,0.0871,-0.231,0.18600000000000003,0.0614,0.243,68.89,16369000000.0,LIFE SCIENCES,237401000,PPG,27.03
243,181.79,184.9,203.82,124.79,"200 N MILWAUKEE AVENUE, VERNON HILLS, IL, US",206.13,Common Stock,1.106,6.14,1402057,USA,USD,"CDW Corporation, headquartered in Lincolnshire, Illinois, is a provider of technology products and services for business, government and education.",7.12,12/10/21,1.6,0.0085,1637000000,7.12,17.89,1.474,11/23/21,NASDAQ,December,21.98,3210100000.0,RETAIL-CATALOG & MAIL-ORDER HOUSES,,9/30/21,25827410000.0,CDW Corporation,,0.0702,1.53,26.74,30.54,1.276,0.05,0.436,0.114,0.0974,0.975,144.29,20240099000.0,TRADE & SERVICES,135723000,CDW,26.74
244,174.84,184.6,197.92,142.04,"BARENGASSE 32, ZURICH, CH",203.88,Common Stock,0.795,137.67,896159,USA,USD,"Chubb Limited, incorporated in Zurich, Switzerland, is the parent company of Chubb, a global provider of insurance products covering property and casualty, accident and health, reinsurance, and life insurance and the largest publicly traded property and casualty company in the world.",19.67,10/8/21,3.16,0.0164,8147000000,19.67,-,2.483,9/16/21,NYSE,December,13.64,7110000000.0,"FIRE, MARINE & CASUALTY INSURANCE",,9/30/21,83064095000.0,Chubb Limited,,0.195,0.874,9.8,1.402,2.057,0.218,0.589,0.14,0.0254,0.152,90.62,40372998000.0,FINANCE,430741000,CB,9.8
245,79.69,76.17,84.48,72.89,"300 PARK AVE, NEW YORK, NY, US",84.45,Common Stock,0.571,0.701,21665,USA,USD,"Colgate-Palmolive Company is an American multinational consumer products company headquartered on Park Avenue in Midtown Manhattan, New York City. It specializes in the production, distribution and provision of household, health care, personal care and veterinary products.",3.14,11/15/21,1.78,0.0228,4407000000,3.14,16.34,4.179,10/20/21,NYSE,December,23.15,10021000000.0,"PERFUMES, COSMETICS & OTHER TOILET PREPARATIONS",,9/30/21,66049864000.0,Colgate-Palmolive Company,,0.222,3.916,24.96,111.22,3.8089999999999997,0.154,-0.07400000000000001,0.063,0.154,428.46,20.45,17341999000.0,LIFE SCIENCES,842849000,CL,24.96
246,724.74,713.76,825.62,585.45,"12405 POWERSCOURT DRIVE, ST. LOUIS, MO, US",798.89,Common Stock,0.963,94.98,1091667,USA,USD,"Charter Communications, Inc., is an American telecommunications and mass media company with services branded as Charter Spectrum.",21.94,None,None,0,20029000000,21.94,10.95,4.162,None,NASDAQ,December,21.1,21198000000.0,CABLE & OTHER PAY TELEVISION SERVICES,,9/30/21,123594000000.0,Charter Communications Inc,,0.207,0.557,31.42,7.31,2.419,0.084,0.667,0.092,0.046,0.177,270.34,51094000000.0,TECHNOLOGY,179291000,CHTR,31.42
247,175.84,164.94,202.76,133.11,"20 SYLVAN ROAD, WOBURN, MA, US",205.21,Common Stock,1.089,32.06,4127,USA,USD,"Skyworks Solutions, Inc. is an American semiconductor company headquartered in Irvine, California, United States. Skyworks manufactures semiconductors for use in Radio Frequency (RF) and mobile communications systems.",8.97,12/14/21,2.06,0.0127,2076000000,8.97,13.65,5.47,11/22/21,NASDAQ,September,13.99,2530100000.0,SEMICONDUCTORS & RELATED DEVICES,,9/30/21,27001207000.0,Skyworks Solutions Inc,,0.321,1.134,18.23,5.05,5.28,0.293,0.32299999999999995,0.37,0.15,0.317,30.93,5109100000.0,MANUFACTURING,165145000,SWKS,18.23
248,92.9,101.35,107.88,56.56,"400 SOUTH HOPE STREET, 25TH FLOOR, LOS ANGELES, CA, US",123.33,Common Stock,1.403,24.28,1138118,USA,USD,"CBRE Group, Inc. is an American commercial real estate services and investment firm. The abbreviation CBRE stands for Coldwell Banker Richard Ellis. It is the largest commercial real estate services company in the world.",4.29,None,None,0,2461770000,4.29,15.03,1.417,None,NYSE,December,23.98,4828075000.0,REAL ESTATE,,9/30/21,35213554000.0,CBRE Group Inc,,0.0631,1.144,24.53,4.429,1.349,0.0559,1.331,0.204,0.0571,0.195,77.8,26106321000.0,REAL ESTATE & CONSTRUCTION,334666000,CBRE,24.53
249,180.86,183.43,210.16,133.7,"1200 URBAN CENTER DRIVE, BIRMINGHAM, AL, US",218.25,Common Stock,0.648,48.42,1396009,USA,USD,"Vulcan Materials Company (NYSE: VMC) is an American company based in Birmingham, Alabama. It is principally engaged in the production, distribution and sale of construction materials.",4.85,12/2/21,1.45,0.0073,1341979000,4.85,21.77,6.02,11/15/21,NYSE,December,30.67,1281481000.0,MINING & QUARRYING OF NONMETALLIC MINERALS (NO FUELS),,9/30/21,26843568000.0,Vulcan Materials Company,,0.18,1.395,41.71,4.115,5.24,0.126,-0.114,0.158,0.0455,0.105,38.58,5121016000.0,ENERGY & TRANSPORTATION,132705000,VMC,41.71
250,196.82,182.2,223.34,166.85,"1000 STANLEY DR, P O BOX 7000, NEW BRITAIN, CT, US",216.93,Common Stock,1.381,70.97,93556,USA,USD,"Stanley Black & Decker, Inc., formerly known as The Stanley Works, is a Fortune 500 American manufacturer of industrial tools and household hardware and provider of security products. Headquartered in the greater Hartford city of New Britain, Connecticut, Stanley Black & Decker is the result of the merger of Stanley Works and Black & Decker on March 12, 2010.",11.24,12/21/21,2.89,0.0152,3151100000,11.24,11.64,2.045,11/30/21,NYSE,December,16,5039100000.0,"CUTLERY, HANDTOOLS & GENERAL HARDWARE",,9/30/21,32039959000.0,Stanley Black & Decker Inc,,0.15,1.368,17.49,2.74,1.8659999999999999,0.106,0.049,0.107,0.0679,0.168,108.64,17168800000.0,MANUFACTURING,162962000,SWK,17.49
251,147.09,158.82,168.5,111.73,"TWO PIERCE PLACE, ITASCA, IL, US",174.36,Common Stock,0.684,40.62,354190,USA,USD,"Arthur J. Gallagher & Co. (AJG) is an American global insurance brokerage and risk management services firm headquartered in Rolling Meadows, Illinois.",4.622,12/17/21,1.89,0.0116,1887900000,4.622,20.88,4.631,12/2/21,NYSE,December,28.74,2510500000.0,"INSURANCE AGENTS, BROKERS & SERVICE",,9/30/21,34352181000.0,Arthur J. Gallagher & Co,,0.179,2.09,35.86,4.005,4.449,0.122,0.17800000000000002,0.165,0.0356,0.138,38.81,7721700000.0,FINANCE,207278000,AJG,35.86
252,101.45,115.89,124.69,66.45,"2800 POST OAK BLVD, SUITE 2600, HOUSTON, TX, US",133.75,Common Stock,1.166,33.29,1050915,USA,USD,"Quanta Services is an American corporation that provides infrastructure services for electric power, pipeline, industrial and communications industries. Capabilities include the planning, design, installation, program management, maintenance and repair of most types of network infrastructure.",3.8089999999999997,10/15/21,0.24,0.0021,1013623000,3.8089999999999997,17.06,1.513,9/30/21,NYSE,December,18.59,1660847000.0,ELECTRICAL WORK,,9/30/21,16615384000.0,Quanta Services Inc,,0.0568,0.75,30.61,3.586,1.3880000000000001,0.0461,0.071,0.11,0.0447,0.127,85.33,11968860000.0,REAL ESTATE & CONSTRUCTION,142499000,PWR,30.61
253,75.79,72.14,142.0,55.65,"825 BERKSHIRE BLVD STE 200, WYOMISSING PROFESSIONAL CENTER, WYOMISSING, PA, US",87.06,Common Stock,2.438,19.46,921738,USA,USD,"Penn National Gaming, Inc. is an American operator of casinos and racetracks, based in Wyomissing, Pennsylvania.",2.359,None,None,0,1317700000,2.359,13.4,3.5,None,NASDAQ,December,19.46,1710700000.0,HOTELS & MOTELS,,9/30/21,9874190000.0,Penn National Gaming Inc,,0.183,-15.89,24.69,3.238,1.8419999999999999,0.0722,-0.442,0.33799999999999997,0.0401,0.136,34.41,5359900000.0,REAL ESTATE & CONSTRUCTION,169514000,PENN,24.69
254,72.5,73.94,79.58,64.39,"6920 SEAWAY BLVD., EVERETT, WA, US",85.31,Common Stock,1.209,25.98,1659166,USA,USD,"Fortive is an American diversified industrial technology conglomerate company headquartered in Everett, Washington.",4.584,12/30/21,0.28,0.0036,1284100000,4.584,13.08,5.76,11/24/21,NYSE,December,25.77,2616700000.0,"INDUSTRIAL INSTRUMENTS FOR MEASUREMENT, DISPLAY, AND CONTROL",,9/30/21,28058726000.0,Fortive Corporation,,0.17300000000000001,1.655,17.07,2.987,5.39,0.319,-0.313,0.12,0.035,0.2,15.14,5203300000.0,LIFE SCIENCES,358578000,FTV,17.07
255,87.83,106.47,117.2,33.99,"500 WEST TEXAS, SUITE 1210, MIDLAND, TX, US",127.79,Common Stock,2.561,63.52,1539838,USA,USD,"Diamondback Energy is a company engaged in hydrocarbon exploration and headquartered in Midland, Texas.",2.5610000000000004,11/18/21,1.75,0.0161,3015000000,2.5610000000000004,12.7,4.73,11/10/21,NASDAQ,December,5.87,2001000000.0,CRUDE PETROLEUM & NATURAL GAS,,9/30/21,19920191000.0,Diamondback Energy Inc,,0.341,0.207,42.93,1.716,3.7910000000000004,0.0839,0.42100000000000004,1.652,0.0541,0.0406,30.72,5255000000.0,ENERGY & TRANSPORTATION,181175000,FANG,42.93
256,230.32,210.2,270.64,200.47,"ONE AMGEN CENTER DRIVE, THOUSAND OAKS, CA, US",244.62,Common Stock,0.608,14.54,318154,USA,USD,"Amgen Inc. (formerly Applied Molecular Genetics Inc.) is an American multinational biopharmaceutical company headquartered in Thousand Oaks, California. Focused on molecular biology and biochemistry, its goal is to provide a healthcare business based on recombinant DNA technology.",9.7,12/8/21,6.88,0.0325,12133000000,9.7,13.02,5.58,11/15/21,NASDAQ,December,11.78,19265000000.0,"BIOLOGICAL PRODUCTS, (NO DISGNOSTIC SUBSTANCES)",,9/30/21,119069000000.0,Amgen Inc,,0.344,1.599,21.79,14.5,4.621,0.218,-0.035,0.044000000000000004,0.0856,0.585,44.89,25767000000.0,LIFE SCIENCES,563266000,AMGN,21.79
257,185.71,178.91,206.44,135.73,"170/175 LAKEVIEW DRIVE, AIRSIDE BUSINESS PARK, SWORDS,, CO. DUBLIN, IE",201.53,Common Stock,1.241,27.26,1466258,USA,USD,"Trane Technologies plc is an American Irish domiciled diversified industrial manufacturing company. It is headquartered near Dublin, Ireland.",5.56,12/31/21,2.3,0.0122,2234100000,5.56,20.84,3.413,12/2/21,NYSE,December,26.95,3827500000.0,AUTO CONTROLS FOR REGULATING RESIDENTIAL & COMML ENVIRONMENTS,,9/30/21,45823840000.0,Trane Technologies plc,,0.145,2.121,34.68,6.92,3.3339999999999996,0.0982,0.017,0.064,0.0689,0.214,57.4,13746200000.0,LIFE SCIENCES,237540000,TT,34.68
258,84.3,85.36,96.49,56.01,"935 STEWART DRIVE, SUNNYVALE, CA, US",96.33,Common Stock,1.541,15.46,864749,USA,USD,"Trimble Inc. is a Sunnyvale, California-based hardware, software and services technology company. Trimble services global industries in Agriculture, Building & Construction, Geospatial, Natural Resources and Utilities, Governments, Transportation and others. Trimble also does hardware development of Global Navigation Satellite System (GNSS) receivers, scanners, laser rangefinders, unmanned aerial vehicles (UAVs), inertial navigation systems and software processing tools.",2.197,None,None,0,772300000,2.197,26.78,6.28,None,NASDAQ,December,28.9,1850100000.0,"MEASURING & CONTROLLING DEVICES, NEC",,9/30/21,21759883000.0,Trimble Inc,,0.165,2.887,39.46,5.53,6.11,0.157,0.45,0.138,0.054000000000000006,0.154,14.18,3562800000.0,LIFE SCIENCES,251008000,TRMB,39.46
259,337.46,363.27,414.99,207.84,"100 FIRST STAMFORD PLACE, 7TH FLOOR, STAMFORD, CT, US",391.47,Common Stock,1.942,75.74,1067701,USA,USD,"United Rentals, Inc. (NYSE: URI) is the world's largest equipment rental company, with about 13 percent of the North American market share as of 2019.",16.53,None,None,0,2468000000,16.53,9.58,4.131,None,NYSE,December,15.48,3232000000.0,"SERVICES-EQUIPMENT RENTAL & LEASING, NEC",,9/30/21,27840715000.0,United Rentals Inc,,0.22699999999999998,1.29,23.26,5.05,3.02,0.13,0.9620000000000001,0.187,0.0685,0.249,127.38,9219000000.0,TRADE & SERVICES,72394000,URI,23.26
260,116.08,118.34,126.73,86.54,"50 S LASALLE ST, CHICAGO, IL, US",131.03,Common Stock,1.174,53.04,73124,USA,USD,"Northern Trust Corporation is a financial services company headquartered in Chicago, Illinois that caters to corporations, institutional investors, and ultra high net worth individuals.",6.34,1/1/22,2.8,0.0225,None,6.34,-,-,12/9/21,NASDAQ,December,16.84,5975800000.0,STATE COMMERCIAL BANKS,,9/30/21,25819009000.0,Northern Trust Corporation,,0.301,1.186,19.61,2.349,4.039,0.21600000000000003,0.364,0.109,0.0086,0.11699999999999999,30.7,6391900000.0,FINANCE,207661000,NTRS,19.61
261,155.69,157.19,163.16,126.63,"385 WASHINGTON ST, SAINT PAUL, MN, US",164.0,Common Stock,0.765,115.75,86312,USA,USD,"The Travelers Companies, Inc., commonly known as Travelers, is an American insurance company.",14.28,12/31/21,3.46,0.0219,5633000000,14.28,-,1.325,12/9/21,NYSE,December,12.82,8085000000.0,"FIRE, MARINE & CASUALTY INSURANCE",,9/30/21,38844817000.0,The Travelers Companies Inc,,0.139,1.134,11.06,1.379,1.136,0.106,-0.18899999999999997,0.064,0.0251,0.129,136.29,34201999000.0,FINANCE,246009000,TRV,11.06
262,221.6,209.3,254.57,168.17,"WHIRLPOOL CNTR 2000 M 63, C/O CORPORATE SECRETARY, BENTON HARBOR, MI, US",255.67,Common Stock,1.768,81.38,106640,USA,USD,"The Whirlpool Corporation is an American multinational manufacturer and marketer of home appliances, headquartered in Benton Charter Township, Michigan, United States.",31.35,12/15/21,5.3,0.0236,3153000000,31.35,5.22,0.768,11/18/21,NYSE,December,10.98,3850000000.0,HOUSEHOLD APPLIANCES,,9/30/21,14102726000.0,Whirlpool Corporation,,0.11900000000000001,1.649,7.41,2.753,0.642,0.0906,0.213,0.037000000000000005,0.0804,0.428,349.95,21967999000.0,MANUFACTURING,60743000,WHR,7.41
263,247.09,244.33,264.69,223.11,"1 BECTON DRIVE, FRANKLIN LAKES, NJ, UNITED STATES",269.64,Common Stock,0.711,82.79,10795,USA,USD,"Becton, Dickinson and Company, also known as BD, is an American multinational medical technology company that manufactures and sells medical devices, instrument systems, and reagents. BD also provides consulting and analytics services in certain geographies.",6.85,12/31/21,3.32,0.0136,5412000000,6.85,17.19,4.231,12/9/21,NYSE,September,18.9,9483000000.0,SURGICAL & MEDICAL INSTRUMENTS & APPARATUS,,9/30/21,69844607000.0,Becton Dickinson and Company,,0.155,1.736,35.5,2.972,3.45,0.10300000000000001,1.4080000000000001,0.073,0.0364,0.0882,69.99,20248001000.0,LIFE SCIENCES,287190000,BDX,35.5
264,55.87,52.43,61.27,42.83,"6400 POPLAR AVENUE, MEMPHIS, TN, US",57.36,Common Stock,0.96,24.85,51434,USA,USD,"The International Paper Company (NYSE: IP) is an American pulp and paper company, the largest such company in the world. The company is headquartered in Memphis, Tennessee.",4.541,12/15/21,2.05,0.0413,3216000000,4.541,7.76,1.283,11/12/21,NYSE,December,10.08,6207000000.0,PAPER MILLS,,9/30/21,19343788000.0,International Paper Company,,0.0902,1.39,11,2.018,0.882,0.08199999999999999,3.239,0.115,0.0403,0.215,56.01,21931999000.0,MANUFACTURING,387263000,IP,11
265,119.84,121.95,129.54,93.8,"1 WEST FIRST AVENUE, CONSHOHOCKEN, PA, UNITED STATES",144.08,Common Stock,0.485,2.811,1140859,USA,USD,AmerisourceBergen Corporation is an American drug wholesale company that was formed by the merger of Bergen Brunswig and AmeriSource in 2001.,7.39,11/29/21,1.76,0.0141,3348977000,7.39,10.43,0.141,11/12/21,NYSE,September,11.92,6943228000.0,"WHOLESALE-DRUGS, PROPRIETARIES & DRUGGISTS' SUNDRIES",,9/30/21,26044023000.0,AmerisourceBergen Corporation,,0.0133,1.543,16.96,44.69,0.122,0.0072,-0.006999999999999999,0.196,0.035,-99999.99,1039.19,213989000000.0,TRADE & SERVICES,207787000,ABC,16.96
