,200DayMovingAverage,50DayMovingAverage,52WeekHigh,52WeekLow,Address,AnalystTargetPrice,AssetType,Beta,BookValue,CIK,Country,Currency,Description,DilutedEPSTTM,DividendDate,DividendPerShare,DividendYield,EBITDA,EPS,EVToEBITDA,EVToRevenue,ExDividendDate,Exchange,FiscalYearEnd,ForwardPE,GrossProfitTTM,Industry,Information,LatestQuarter,MarketCapitalization,Name,Note,OperatingMarginTTM,PEGRatio,PERatio,PriceToBookRatio,PriceToSalesRatioTTM,ProfitMargin,QuarterlyEarningsGrowthYOY,QuarterlyRevenueGrowthYOY,ReturnOnAssetsTTM,ReturnOnEquityTTM,RevenuePerShareTTM,RevenueTTM,Sector,SharesOutstanding,Symbol,TrailingPE
314,1426.2,1444.85,1626.62,1033.4,"1900 POLARIS PARKWAY, COLUMBUS, OH, US",1498.1,Common Stock,1.034,6.92,1037646,USA,USD,"Mettler Toledo (NYSE: MTD) is a multinational manufacturer of scales and analytical instruments. It is the largest provider of weighing instruments for use in laboratory, industrial, and food retailing applications. The company also provides various analytical instruments, process analytics instruments, and end-of-line inspection systems.",31.9,None,None,0,1046090000,31.9,33.8,10.08,None,NYSE,December,43.67,1801031000,LABORATORY ANALYTICAL INSTRUMENTS,,2021-09-30,35250639000,Mettler-Toledo International Inc,,0.271,2.965,48.07,219.68,9.74,0.208,0.304,0.179,0.205,250.54,155.22,3618676000,LIFE SCIENCES,22985700,MTD,48.07
315,42.35,46.6,51.17,25.5,"3600 LAS VEGAS BLVD S, LAS VEGAS, NV, US",55.17,Common Stock,2.373,14.54,789570,USA,USD,MGM Resorts International is an American global hospitality and entertainment company operating destination resorts globally.,1.247,2021-12-15,0.01,0.0002,1078422000,1.247,14.91,4.943,2021-12-09,NYSE,December,147.06,1709371000,HOTELS & MOTELS,,2021-09-30,21145407000,MGM Resorts International,,-0.0095,4.2,36.16,3.119,2.711,0.0866,31.15,1.398,-0.0012,0.0541,15.95,7800770000,REAL ESTATE & CONSTRUCTION,468960000,MGM,36.16
325,92.58,88.06,99.89,82.85,"1 MONSTER WAY, CORONA, CA, US",105.19,Common Stock,1.067,11.8,865752,USA,USD,"Monster Beverage Corporation is an American beverage company that manufactures energy drinks including Monster Energy, Relentless and Burn.",2.86,None,None,0,1842898000,2.86,26.0,9.02,None,NASDAQ,December,30.12,2723880000,BOTTLED & CANNED SOFT DRINKS & CARBONATED WATERS,,2021-09-30,48712536000,Monster Beverage Corporation,,0.336,3.127,32.19,7.82,9.17,0.288,-0.031,0.132,0.17,0.281,10.05,5312591000,MANUFACTURING,529139000,MNST,32.19
326,364.19,375.7,407.94,259.86,"7 WORLD TRADE CENTER, AT 250 GREENWICH STREET, NEW YORK, NY, US",427.45,Common Stock,1.164,13.07,1059556,USA,USD,"Moody's Corporation, often referred to as Moody's, is an American business and financial services company. It is the holding company for Moody's Investors Service (MIS), an American credit rating agency, and Moody's Analytics (MA), an American provider of financial analysis software and services.",11.16,2021-12-14,2.42,0.0063,3082000000,11.16,25.19,12.96,2021-11-22,NYSE,December,30.49,3896000000,"SERVICES-CONSUMER CREDIT REPORTING, COLLECTION AGENCIES",,2021-09-30,72132919000,Moody's Corporation,,0.477,2.727,34.76,29.49,12.08,0.352,0.024,0.125,0.136,0.975,31.95,5969000000,TRADE & SERVICES,185900000,MCO,34.76
327,95.76,100.65,105.34,55.7,"1585 BROADWAY, NEW YORK, NY, US",112.33,Common Stock,1.546,54.56,895421,USA,USD,"Morgan Stanley is an American multinational investment bank and financial services company headquartered at 1585 Broadway in the Morgan Stanley Building, Midtown Manhattan, New York City.",7.83,2021-11-15,2.1,0.0212,None,7.83,-,-,2021-10-28,NYSE,December,13.23,42804000000,"SECURITY BROKERS, DEALERS & FLOTATION COMPANIES",,2021-09-30,179171836000,Morgan Stanley,,0.398,6.3,12.75,1.808,3.075,0.253,0.193,0.259,0.0138,0.15,32.53,58269000000,FINANCE,1794410000,MS,12.75
328,34.54,39.4,42.99,18.02,"101 EAST KENNEDY BLVD., SUITE 2500, TAMPA, FL, US",44.93,Common Stock,1.76,27.48,1285785,USA,USD,"The Mosaic Company is a Fortune 500 company based in Tampa, Florida which mines phosphate and potash, and operates through segments such as international distribution and Mosaic Fertilizantes.",4.672,2021-12-16,0.25,0.0068,2739300000,4.672,6.25,1.542,2021-12-01,NYSE,December,6.76,1064900000,AGRICULTURAL CHEMICALS,,2021-09-30,13849629000,The Mosaic Company,,0.18,0.283,8.0,1.308,1.262,0.163,8.5,0.435,0.0619,0.187,28.92,10973800000,LIFE SCIENCES,370410000,MOS,8.0
329,225.06,242.8,254.7,161.49,"500 W. MONROE ST., CHICAGO, IL, US",270.27,Common Stock,0.78,-5.88,68505,USA,USD,"Motorola Solutions, Inc., is an American data communications and telecommunications equipment provider that succeeded Motorola, Inc., following the spinoff of the mobile phone division into Motorola Mobility in 2011. The company is headquartered in Chicago, Illinois.",7.25,2021-10-15,2.84,0.0115,2293000000,7.25,20.99,5.7,2021-09-14,NYSE,December,25.32,3637000000,RADIO & TV BROADCASTING & COMMUNICATIONS EQUIPMENT,,2021-09-30,42448036000,Motorola Solutions Inc,,0.229,1.942,34.69,-,5.22,0.155,0.492,0.128,0.107,-99999.99,47.96,8124000000,MANUFACTURING,168897000,MSI,34.69
338,78.89,82.32,86.97,67.66,"700 UNIVERSE BLVD, JUNO BEACH, FL, US",91.3,Common Stock,0.263,18.68,753308,USA,USD,"NextEra Energy, Inc. is an American energy company with about 46 gigawatts of generating capacity, revenues of over $17 billion in 2017, and about 14,000 employees throughout the US and Canada. Its subsidiaries include Florida Power & Light (FPL), NextEra Energy Resources, NextEra Energy Partners, Gulf Power Company, and NextEra Energy Services.",0.614,2021-12-15,1.505,0.0176,7016000000,0.614,33.16,13.53,2021-11-24,NYSE,December,31.06,10707000000,ELECTRIC SERVICES,,2021-09-30,169352298000,NextEra Energy Inc,,0.172,3.524,140.57,4.571,10.31,0.144,-0.633,-0.087,0.0133,0.0387,8.37,16418000000,ENERGY & TRANSPORTATION,1962140000,NEE,140.57
339,23.17,20.0,28.28,15.51,"85 BROAD STREET, NEW YORK, NY, US",26.25,Common Stock,1.401,8.62,1492633,USA,USD,"Nielsen Holdings PLC is an American, UK-domiciled, information, data and market measurement firm.",2.183,2021-12-02,0.24,0.0114,1034000000,2.183,9.2,2.035,2021-11-17,NYSE,December,11.88,3530000000,"SERVICES-BUSINESS SERVICES, NEC",,2021-09-30,7569770000,Nielsen Holdings plc,,0.138,1.77,9.66,2.444,1.181,0.122,12.91,0.055,0.0411,0.0472,17.89,6407000000,TRADE & SERVICES,358927000,NLSN,9.66
340,153.48,159.14,179.1,124.98,"ONE BOWERMAN DR, BEAVERTON, OR, US",179.84,Common Stock,0.932,9.06,320187,USA,USD,"Nike, Inc. is an American multinational corporation that is engaged in the design, development, manufacturing, and worldwide marketing and sales of footwear, apparel, equipment, accessories, and services. The company is headquartered near Beaverton, Oregon, in the Portland metropolitan area. It is the world's largest supplier of athletic shoes and apparel and a major manufacturer of sports equipment.",3.771,2021-10-01,1.1,0.0066,8337000000,3.771,36.38,5.75,2021-08-27,NYSE,May,45.66,20001000000,RUBBER & PLASTICS FOOTWEAR,,2021-08-31,267639030000,NIKE Inc,,0.164,3.404,44.84,18.57,5.79,0.132,0.221,0.156,0.133,0.516,29.27,46192001000,MANUFACTURING,1277810000,NKE,44.84
341,25.1,24.67,26.14,20.35,"801 EAST 86TH AVE, MERRILLVILLE, IN, US",28.27,Common Stock,0.312,12.16,1111711,USA,USD,"NiSource Inc. is one of the largest fully regulated utility companies in the United States. The company is based in Merrillville, Indiana.",1.095,2021-11-19,0.88,0.0351,1716900000,1.095,12.27,4.5,2021-10-28,NYSE,December,17.67,2044900000,ELECTRIC & OTHER SERVICES COMBINED,,2021-09-30,9849041000,NiSource Inc,,0.22,2.911,22.9,2.063,2.095,0.107,3.5,0.063,0.0284,0.0838,12.01,4702000000,ENERGY & TRANSPORTATION,392705000,NI,22.9
342,267.39,270.35,294.94,222.6,"THREE COMMERCIAL PL, NORFOLK, VA, US",300.08,Common Stock,1.343,57.07,702165,USA,USD,"The Norfolk Southern Railway is a Class I freight railroad in the United States, and is the current name of the former Southern Railway. With headquarters in Atlanta, Georgia, the company operates 19,420 route miles (31,250 km) in 22 eastern states, the District of Columbia, and has rights in Canada over the Albany to Montreal route of the Canadian Pacific Railway, and previously on CN from Buffalo to St. Thomas.",11.62,2021-11-19,4.01,0.0145,5571000000,11.62,14.27,7.32,2021-11-04,NYSE,December,20.28,4632000000,"RAILROADS, LINE-HAUL OPERATING",,2021-09-30,67214320000,Norfolk Southern Corporation,,0.405,1.637,23.77,4.835,6.19,0.268,0.378,0.138,0.0717,0.202,43.5,10863000000,ENERGY & TRANSPORTATION,243345000,NSC,23.77
352,587.83,628.42,669.09,424.03,"233 S PATTERSON AVE, SPRINGFIELD, MO, US",692,Common Stock,0.997,3.149,898173,USA,USD,"O'Reilly Auto Parts is an American auto parts retailer that provides automotive aftermarket parts, tools, supplies, equipment, and accessories in the United States serving both the professional service providers and do-it-yourself customers.",28.78,None,None,0,3099738000,28.78,15.74,3.802,None,NASDAQ,December,21.88,6085692000,RETAIL-AUTO & HOME SUPPLY STORES,,2021-09-30,43727233000,O'Reilly Automotive Inc,,0.216,1.402,22.55,210.18,3.399,0.159,0.141,0.085,0.143,3.848,183.31,12864843000,TRADE & SERVICES,67378000,ORLY,22.55
353,28.35,32.54,35.75,12.23,"5 GREENWAY PLAZA, SUITE 110, HOUSTON, TX, US",40.44,Common Stock,2.357,9.76,797468,USA,USD,"Occidental Petroleum Corporation is an American company engaged in hydrocarbon exploration in the United States, the Middle East, and Colombia as well as petrochemical manufacturing in the United States, Canada, and Chile.",-1.212,2022-01-14,0.04,0.0012,10295000000,-1.212,6.94,3.164,2021-12-09,NYSE,December,53.48,9341000000,CRUDE PETROLEUM & NATURAL GAS,,2021-09-30,29860866000,Occidental Petroleum Corporation,,0.0811,1.16,None,3.293,1.345,-0.0147,0,0.653,0.014,0.0041,23.77,22203001000,ENERGY & TRANSPORTATION,933981000,OXY,-
354,280.03,314.56,361.6,189.01,"500 OLD DOMINION WAY, THOMASVILLE, NC, US",319.23,Common Stock,1.049,29.73,878927,USA,USD,"Old Dominion Freight Line, Inc. is an American less than truckload shipping (LTL) company. It offers regional, inter-regional and national LTL service. In addition to its core LTL services, the company offers logistics services including ground and air expedited transportation, supply chain consulting, transportation management, truckload brokerage, container delivery and warehousing, as well as household moving services.",8.09,2021-12-15,0.75,0.0021,1531629000,8.09,25.95,8.07,2021-11-30,NASDAQ,December,37.59,1458315000,TRUCKING (NO LOCAL),,2021-09-30,41153237000,Old Dominion Freight Line Inc,,0.259,2.18,44.25,11.75,8.37,0.192,0.444,0.323,0.179,0.287,42.33,4919359000,ENERGY & TRANSPORTATION,115011000,ODFL,44.25
355,76.44,72.41,84.84,55.98,"437 MADISON AVE, NEW YORK, NY, US",83.62,Common Stock,0.854,15.43,29989,USA,USD,"Omnicom Group Inc. is an American global media, marketing and corporate communications holding company, headquartered in New York City.",6.42,2021-10-12,2.75,0.0395,2208400000,6.42,6.84,1.172,2021-09-20,NYSE,December,10.66,2316900000,SERVICES-ADVERTISING AGENCIES,,2021-09-30,14651692000,Omnicom Group Inc,,0.141,0.953,10.74,4.512,1.032,0.0979,0.138,0.071,0.0506,0.404,65.96,14190600000,TRADE & SERVICES,212559000,OMC,10.74
356,55.91,62.66,65.83,29.4,"100 WEST 5TH ST, TULSA, OK, US",64,Common Stock,1.877,13.1,1039684,USA,USD,"Oneok, Inc. is a diversified Fortune 500 energy corporation based in Tulsa, Oklahoma.",3.195,2021-11-15,3.74,0.059,3082738000,3.195,13.09,3.089,2021-10-29,NYSE,December,16.29,3432096000,NATURAL GAS TRANSMISISON & DISTRIBUTION,,2021-09-30,28134164000,ONEOK Inc,,0.18,1.437,19.75,4.837,2.055,0.104,0.253,1.086,0.066,0.238,30.69,13690395000,ENERGY & TRANSPORTATION,445937000,OKE,19.75
357,86.64,94.11,98.95,54.72,"500 ORACLE PARKWAY, MAIL STOP 5 OP 7, REDWOOD CITY, CA, US",89.32,Common Stock,0.8,1.861,1341439,USA,USD,"Oracle is an American multinational computer technology corporation headquartered in Austin, Texas. The company was formerly headquartered in Redwood Shores, California until December 2020 when it moved its headquarters to Texas. The company sells database software and technology, cloud engineered systems, and enterprise software products, particularly its own brands of database management systems.",4.72,2021-10-26,1.12,0.0119,18116999000,4.72,16.12,7.36,2021-10-08,NYSE,May,20,32624000000,SERVICES-PREPACKAGED SOFTWARE,,2021-08-31,255682036000,Oracle Corporation,,0.385,2.548,19.82,47.38,6.26,0.342,0.194,0.039,0.0832,1.473,14.2,40839999000,TECHNOLOGY,2733690000,ORCL,19.82
367,71.86,73.61,80.18,49.42,"REGAL HOUSE, 70 LONDON ROAD, TWICKENHAM, LONDON, GB",79.38,Common Stock,1.079,14.13,77360,USA,USD,"Pentair plc (PNR) is an American water treatment company with its main U.S. office in Minneapolis, Minnesota.",3.021,2021-11-05,0.79,0.0107,704000000,3.021,18.94,3.595,2021-10-21,NYSE,December,19.61,1066200000,SPECIAL INDUSTRY MACHINERY (NO METALWORKING MACHINERY),,2021-09-30,12458888000,Pentair plc,,0.176,1.575,24.92,5.23,3.488,0.142,0.302,0.214,0.0914,0.231,21.51,3572200000,TECHNOLOGY,165478000,PNR,24.92
368,17.33,17.85,19.19,11.82,"C/O PEOPLE'S BANK, 850 MAIN STREET, BRIDGEPORT, CT, US",18.33,Common Stock,1.1,17.84,1378946,USA,USD,"People's United Financial, Inc. is an American bank holding company that owns People's United Bank.",0.702,2021-11-15,0.725,0.0394,None,0.702,-,-,2021-10-29,NASDAQ,December,14.35,1904800000,"SAVINGS INSTITUTION, FEDERALLY CHARTERED",,2021-09-30,7901249000,People's United Financial Inc,,0.467,5.52,26.3,1.045,3.928,0.154,-0.052,0.001,0.005,0.0397,4.791,2011800000,FINANCE,428020000,PBCT,26.3
369,152.96,158.27,166.43,125.76,"700 ANDERSON HILL RD, PURCHASE, NY, US",167.4,Common Stock,0.634,11.48,77476,USA,USD,"PepsiCo, Inc. is an American based multinational food, snack, and beverage corporation headquartered in Harrison, New York, in the hamlet of Purchase. PepsiCo's business encompasses all aspects of the food and beverage market. It oversees the manufacturing, distribution, and marketing of its products.",5.87,2021-09-30,4.195,0.0258,13886000000,5.87,18.09,3.382,2021-09-02,NASDAQ,December,24.33,38637000000,BEVERAGES,,2021-09-30,224888013000,PepsiCo Inc,,0.154,3.09,27.71,14.17,2.933,0.106,-0.03,0.116,0.0798,0.554,55.55,76681003000,MANUFACTURING,1382650000,PEP,27.71
370,164.5,173.89,191.92,119.79,"940 WINTER STREET, WALTHAM, MA, US",188.82,Common Stock,1.06,55.14,31791,USA,USD,"PerkinElmer, Inc., previously styled Perkin-Elmer, is an American global corporation focused in the business areas of diagnostics, life science research, food, environmental and industrial testing. Its capabilities include detection, imaging, informatics, and service. PerkinElmer produces analytical instruments, genetic testing and diagnostic tools, medical imaging components, software, instruments, and consumables for multiple end markets.",10.02,2022-02-11,0.28,0.0016,1948466000,10.02,15.01,5.42,2022-01-20,NYSE,December,26.74,2120607000,LABORATORY ANALYTICAL INSTRUMENTS,,2021-09-30,23169057000,PerkinElmer Inc,,0.327,38.21,18.32,3.247,4.581,0.224,-0.293,0.21,0.0948,0.223,44.91,5057450000,LIFE SCIENCES,126200000,PKI,18.32
371,42.55,43.74,51.41,32.45,"235 E 42ND ST, NEW YORK, NY, US",46.58,Common Stock,0.666,12.51,78003,USA,USD,"Pfizer Inc. is an American multinational pharmaceutical and biotechnology corporation headquartered on 42nd Street in Manhattan, New York City. The name of the company commemorates its co-founder, Charles Pfizer (1824-1906). Pfizer develops and produces medicines and vaccines for immunology, oncology, cardiology, endocrinology, and neurology. The company has several blockbuster drugs or products that each generate more than 1 billion USD in annual revenues.",3.501,2021-12-06,1.55,0.0309,27558001000,3.501,13.28,4.676,2021-11-04,NYSE,December,11.53,33334000000,PHARMACEUTICAL PREPARATIONS,,2021-09-30,278820684000,Pfizer Inc,,0.325,1.817,14.2,4.017,4.021,0.287,2.637,0.986,0.0545,-99999.99,12.41,69336998000,LIFE SCIENCES,5606690000,PFE,14.2
381,139.75,142.52,147.31,119.27,"ONE PROCTER & GAMBLE PLAZA, CINCINNATI, OH, US",152.79,Common Stock,0.412,18.7,80424,USA,USD,"The Procter & Gamble Company (P&G) is an American multinational consumer goods corporation headquartered in Cincinnati, Ohio, founded in 1837 by William Procter and James Gamble. It specializes in a wide range of personal health, consumer health, personal care, and hygiene products; these products are organized into several segments including Beauty; Grooming; Health Care; Fabric & Home Care; and Baby, Feminine, & Family Care. Before the sale of Pringles to Kellogg's, its product portfolio also included food, snacks, and beverages.",5.47,2021-11-15,3.321,0.0227,21248000000,5.47,18.31,4.891,2021-10-21,NYSE,June,24.75,39144000000,"SOAP, DETERGENTS, CLEANG PREPARATIONS, PERFUMES, COSMETICS",,2021-09-30,354667889000,The Procter & Gamble Company,,0.239,5.38,26.78,7.83,4.598,0.183,-0.014,0.053,0.0964,0.298,31.47,77138002000,LIFE SCIENCES,2419950000,PG,26.78
382,96.24,93.05,107.36,81.95,"6300 WILSON MILLS RD, MAYFIELD VILLAGE, OH, US",96.17,Common Stock,0.49,30.88,80661,USA,USD,"The Progressive Corporation is an American insurance company, one of the largest providers of car insurance in the United States. The company insures motorcycles, boats, RVs, and commercial vehicles and provides home insurance through select companies.",6.88,2021-10-15,4.9,0.0511,5670300000,6.88,-,1.313,2021-10-06,NYSE,December,18.08,8673100000,"FIRE, MARINE & CASUALTY INSURANCE",,2021-09-30,56265605000,The Progressive Corporation,,0.115,90.43,13.98,3.105,1.207,0.0874,-0.927,0.083,0.0492,0.222,79.69,46601699000,FINANCE,585064000,PGR,13.98
383,128.29,137.77,149.92,91.61,"PIER 1 BAY 1, SAN FRANCISCO, CA, US",154.97,Common Stock,0.803,43.88,1045609,USA,USD,"Prologis, Inc. is a real estate investment trust headquartered in San Francisco, California that invests in logistics facilities, with a focus on the consumption side of the global supply chain.",2.644,2021-09-30,2.47,0.0166,3383101000,2.644,30.21,27.56,2021-09-16,NYSE,December,80,3566001000,REAL ESTATE INVESTMENT TRUSTS,,2021-09-30,109597835000,Prologis Inc,,0.364,9.85,56.07,3.39,22.34,0.402,1.415,0.102,0.0198,0.0589,6.64,4905616000,REAL ESTATE & CONSTRUCTION,739327000,PLD,56.07
384,105.08,109.67,115.52,70.05,"751 BROAD ST, NEWARK, NJ, US",112.36,Common Stock,1.64,163.31,1137774,USA,USD,"Prudential Financial, Inc. is an American company whose subsidiaries provide insurance, investment management, and other financial products and services to both retail and institutional customers throughout the United States and in over 40 other countries.",18.36,2021-09-16,4.55,0.0413,8946000000,18.36,-,0.854,2021-11-22,NYSE,December,8.51,13648000000,LIFE INSURANCE,,2021-09-30,41795461000,Prudential Financial Inc,,0.126,1.519,6.02,0.673,0.593,0.104,0.053,0.399,0.006,0.117,179.88,70495003000,FINANCE,378000000,PRU,6.02
385,131.48,123.51,153.73,95.6,"121 SEAPORT BOULEVARD, BOSTON, MA, UNITED STATES",160.92,Common Stock,1.247,17.39,857005,USA,USD,"PTC Inc. is an American computer software and services company founded in 1985 and headquartered in Boston, Massachusetts.",4.03,None,None,0,483208000,4.03,30.43,8.51,None,NASDAQ,September,29.85,1436057000,SERVICES-PREPACKAGED SOFTWARE,,2021-09-30,14221416000,PTC Inc,,0.22,2.3,30.06,6.9,7.87,0.264,4.486,0.229,0.063,0.274,15.47,1807159000,TECHNOLOGY,117382000,PTC,30.06
395,90.98,98.2,103.46,56.36,"880 CARILLON PARKWAY, ST. PETERSBURG, FL, UNITED STATES",118.63,Common Stock,1.219,38.28,720005,USA,USD,"Raymond James Financial is an American multinational independent investment bank and financial services company providing financial services to individuals, corporations, and municipalities through its subsidiary companies that engage primarily in investment and financial planning, in addition to investment banking and asset management.",5.62,2021-10-15,1.027,0.0102,None,5.62,-,-,2021-09-30,NYSE,September,14.64,7263000000,"SECURITY BROKERS, DEALERS & FLOTATION COMPANIES",,2021-09-30,20574384000,Raymond James Financial Inc,,0.182,2.16,17.8,2.637,2.239,0.129,1.024,0.314,0.0232,0.158,44.69,9188000000,FINANCE,205785000,RJF,17.8
396,86.65,89.29,92.32,63.85,"870 WINTER STREET, WALTHAM, MA, US",103.65,Common Stock,1.005,47.6,101829,USA,USD,"Raytheon Technologies Corporation is an American multinational aerospace and defense conglomerate headquartered in Waltham, Massachusetts. It is one of the largest aerospace, intelligence services providers, and defense manufacturers in the world by revenue and market capitalization. Raytheon Technologies (RTX) researches, develops, and manufactures advanced technology products in the aerospace and defense industry, including aircraft engines, avionics, aerostructures, cybersecurity, guided missiles, air defense systems, satellites, and drones.",2.2,2021-12-16,1.97,0.0221,11009000000,2.2,15.86,2.514,2021-11-18,NYSE,December,17.67,9017000000,AIRCRAFT ENGINES & ENGINE PARTS,,2021-09-30,133003878000,Raytheon Technologies Corporation,,0.101,0.726,40.39,1.893,2.086,0.052,4.298,0.099,0.0251,0.0502,42.42,63763001000,MANUFACTURING,1496780000,RTX,40.39
397,69.32,69.62,74.35,55.03,"11995 EL CAMINO REAL, SAN DIEGO, CA, US",79.25,Common Stock,0.777,32.99,726728,USA,USD,"Realty Income Corporation is a real estate investment trust that invests in free-standing, single-tenant commercial properties in the United States, Puerto Rico, and the United Kingdom that are subject to NNN Leases. The company is organized in Maryland with its headquarters in San Diego, California.",1.268,2021-11-15,2.819,0.0389,1653415000,1.268,32.36,27.11,2021-11-01,NYSE,December,42.02,1547022000,REAL ESTATE INVESTMENT TRUSTS,,2021-09-30,41730572000,Realty Income Corporation,,0.483,4.876,57.37,3.018,22.97,0.261,4.143,0.216,0.0252,0.0398,4.87,1817037000,REAL ESTATE & CONSTRUCTION,565758000,O,57.37
398,66.77,70.72,78.07,42.3,"ONE INDEPENDENT DRIVE, SUITE 114, JACKSONVILLE, FL, US",74.24,Common Stock,1.094,35.56,910606,USA,USD,"Regency Centers Corporation is a real estate investment trust based in Jacksonville, Florida and is one of the largest operators of shopping centers with grocery stores as anchor tenants.",1.94,2022-01-05,2.38,0.0317,722347000,1.94,20.67,14.61,2021-12-15,NASDAQ,December,38.76,734854000,REAL ESTATE INVESTMENT TRUSTS,,2021-09-30,12781050000,Regency Centers Corporation,,0.375,1.921,38.48,2.12,10.99,0.285,8.86,0.281,0.025,0.0549,6.85,1163439000,REAL ESTATE & CONSTRUCTION,171213000,REG,38.48
399,577.54,591.5,686.62,441,"777 OLD SAW MILL RIVER ROAD, TARRYTOWN, NY, US",703.29,Common Stock,0.188,163.52,872589,USA,USD,"Regeneron Pharmaceuticals, Inc. is an American biotechnology company headquartered in Westchester County, New York. Originally focused on neurotrophic factors and their regenerative capabilities, giving rise to its name, the company then branched out into the study of both cytokine and tyrosine kinase receptors.",62.53,None,None,0,7465800000,62.53,7.67,4.748,None,NASDAQ,December,12.76,4455500000,PHARMACEUTICAL PREPARATIONS,,2021-09-30,67881144000,Regeneron Pharmaceuticals Inc,,0.538,1.07,10.1,3.905,5.08,0.524,0.939,0.505,0.226,0.511,126.6,13356200000,LIFE SCIENCES,105720000,REGN,10.1
400,21.25,22.92,24.78,14.51,"1900 FIFTH AVENUE NORTH, BIRMINGHAM, AL, US",25.84,Common Stock,1.514,17.75,1281761,USA,USD,"Regions Financial Corporation is a bank holding company headquartered in the Regions Center in Birmingham, Alabama. The company provides retail banking and commercial banking, trust, stockbrokerage, and mortgage services.",2.669,2022-01-03,0.635,0.0263,None,2.669,-,-,2021-12-02,NYSE,December,11.56,4955000000,NATIONAL COMMERCIAL BANKS,,2021-09-30,22831129000,Regions Financial Corporation,,0.487,0.746,8.97,1.357,3.189,0.377,0.25,0.155,0.0179,0.148,7.47,7160000000,FINANCE,953283000,RF,8.97
410,254.42,288.92,311.75,201.51,"THE LANDMARK, ONE MARKET STREET STE.300, SAN FRANCISCO, CA, US",317.21,Common Stock,1.068,56.77,1108524,USA,USD,"Salesforce.com, Inc. is an American cloud-based software company headquartered in San Francisco, California. It provides customer relationship management (CRM) service and also provides a complementary suite of enterprise applications focused on customer service, marketing automation, analytics, and application development.",2.497,None,None,0,3570000000,2.497,74.76,12.85,None,NYSE,January,66.67,15814000000,SERVICES-PREPACKAGED SOFTWARE,,2021-07-31,298409001000,salesforce.com inc,,0.0492,4.384,122.07,5.34,12.68,0.0999,-0.804,0.231,0.0099,0.0501,25.56,23538999000,TECHNOLOGY,979000000,CRM,122.07
411,330.94,339.91,369.56,231.48,"8051 CONGRESS AVENUE, BOCA RATON, FL, US",377.47,Common Stock,0.252,-29.53,1034054,USA,USD,"SBA Communications Corporation is a real estate investment trust which owns and operates wireless infrastructure in the United States, Canada, Central America, South America, and South Africa.",2.606,2021-12-16,2.32,0.0068,1489095000,2.606,35.07,22.75,2021-11-17,NASDAQ,December,75.19,1590028000,REAL ESTATE INVESTMENT TRUSTS,,2021-09-30,37399994000,SBA Communications Corporation,,0.346,2.09,131.93,-,16.63,0.131,1.15,0.127,0.052,0,20.49,2249603000,REAL ESTATE & CONSTRUCTION,108781000,SBAC,131.93
412,30.76,32.53,36.71,18.21,"5599 SAN FELIPE, 17TH FLOOR, HOUSTON, TX, US",36.68,Common Stock,2.303,9.53,87347,USA,USD,"Schlumberger Limited is an oilfield services company. Schlumberger has four principal executive offices located in Paris, Houston, London, and The Hague.",1.164,2022-01-13,0.5,0.0153,4604000000,1.164,12.16,2.628,2021-11-30,NYSE,December,17.92,2601000000,"OIL & GAS FIELD SERVICES, NEC",,2021-09-30,45950157000,Schlumberger Limited,,0.109,0.433,28.14,3.441,2.067,0.0744,0.094,0.112,0.0357,0.131,15.91,22236000000,ENERGY & TRANSPORTATION,1402630000,SLB,28.14
