,200DayMovingAverage,50DayMovingAverage,52WeekHigh,52WeekLow,Address,AnalystTargetPrice,AssetType,Beta,BookValue,CIK,Country,Currency,Description,DilutedEPSTTM,DividendDate,DividendPerShare,DividendYield,EBITDA,EPS,EVToEBITDA,EVToRevenue,ExDividendDate,Exchange,FiscalYearEnd,ForwardPE,GrossProfitTTM,Industry,Information,LatestQuarter,MarketCapitalization,Name,Note,OperatingMarginTTM,PEGRatio,PERatio,PriceToBookRatio,PriceToSalesRatioTTM,ProfitMargin,QuarterlyEarningsGrowthYOY,QuarterlyRevenueGrowthYOY,ReturnOnAssetsTTM,ReturnOnEquityTTM,RevenuePerShareTTM,RevenueTTM,Sector,SharesOutstanding,Symbol,TrailingPE
44,61.62,68.36,77.44,27.0,"THREE LIMITED PKWY, P O BOX 16000, COLUMBUS, OH, US",82.22,Common Stock,1.738,None,701985,USA,USD,None,6.49,2021-12-03,0.15,0.002,3573000000,6.49,7.96,1.893,2021-11-18,NYSE,January,17.18,5607000000,RETAIL-WOMEN'S CLOTHING STORES,,2021-07-31,19648201000,Bath Body Works Inc,,0.215,1.465,11.45,-,1.382,0.13,0,0.431,0.18,0,51.13,14214000000,TRADE & SERVICES,264373000,BBWI,11.45
46,28.62,23.5,37.31,18.78,"TWO FOLSOM STREET, SAN FRANCISCO, CA, US",32.3,Common Stock,1.666,8.03,39911,USA,USD,"The Gap, Inc., commonly known as Gap Inc. or Gap, is an American worldwide clothing and accessories retailer.",1.974,2022-01-26,0.12,0.0048,1350000000,1.974,9.62,0.844,2022-01-04,NYSE,January,10.64,6080000000,RETAIL-FAMILY CLOTHING STORES,,2021-07-31,9334925000,The Gap Inc,,0.0514,4.149,12.57,3.108,0.562,0.0453,-0.324,0.286,0.0389,0.286,44.2,16620000000,TRADE & SERVICES,376105000,GPS,12.57
47,23.66,23.68,26.09,16.9,"1211 AVENUE OF THE AMERICAS, NEW YORK, NY, US",32.6,Common Stock,1.385,13.85,1564708,USA,USD,"News Corporation is an American mass media and publishing company operating across digital real estate information, news media, book publishing, and cable television.",0.83,2021-10-13,0.2,0.0085,1178000000,0.83,10.5,1.577,2021-09-14,NASDAQ,June,31.06,4579000000,NEWSPAPERS: PUBLISHING OR PUBLISHING & PRINTING,,2021-09-30,14081808000,News Corporation,,0.0767,2.369,28.6,1.702,1.445,0.0505,4.722,0.182,0.0303,0.0692,16.49,9743000000,MANUFACTURING,199630000,NWS,28.6
48,32.81,33.58,36.45,27.47,"500 WATER STREET, 15TH FLOOR, JACKSONVILLE, FL, US",37.84,Common Stock,1.233,5.93,277948,USA,USD,"CSX Corporation is an American holding company focused on rail transportation and real estate in North America, among other industries. Based in Richmond, Virginia, USA after the merger, in 2003 the CSX Corporation headquarters moved to Jacksonville, Florida.",1.589,2021-12-15,0.365,0.0104,6523000000,1.589,13.46,7.77,2021-11-29,NASDAQ,December,19.84,5795000000,"RAILROADS, LINE-HAUL OPERATING",,2021-09-30,78139433000,CSX Corporation,,0.429,1.636,22.17,5.92,6.56,0.303,0.344,0.243,0.0804,0.279,5.25,11920000000,ENERGY & TRANSPORTATION,2217980000,CSX,22.17
49,440.49,408.61,526,292.65,"5200 ILLUMINA WAY, SAN DIEGO, CA, US",438.69,Common Stock,0.86,67.47,1110803,USA,USD,"Illumina, Inc. is an American company. Incorporated on April 1, 1998, Illumina develops, manufactures, and markets integrated systems for the analysis of genetic variation and biological function. The company provides a line of products and services that serves the sequencing, genotyping and gene expression, and proteomics markets. Its headquarters are located in San Diego, California.",6.11,None,None,0,918000000,6.11,44.77,14.36,None,NASDAQ,December,91.74,2231000000,LABORATORY ANALYTICAL INSTRUMENTS,,2021-09-30,60309918000,Illumina Inc,,0.165,2.948,63.16,5.68,14.09,0.212,0.719,0.395,0.0393,0.119,28.97,4280000000,LIFE SCIENCES,156300000,ILMN,63.16
50,166.59,165.82,179.5,140.42,"PO BOX 807, 663 HWY 60, MONETT, MO, US",178.71,Common Stock,0.591,18.85,779152,USA,USD,"Jack Henry & Associates, Inc. is a technology company and payment processing service for the financial services industry.",4.302,2021-09-29,1.81,0.0114,467786000,4.302,20.55,6.72,2021-09-08,NASDAQ,June,34.72,694826000,SERVICES-COMPUTER INTEGRATED SYSTEMS DESIGN,,2021-09-30,11679228000,Jack Henry & Associates Inc,,0.231,2.882,36.67,8.93,6.51,0.18,0.159,0.08,0.112,0.219,23.95,1794481000,TECHNOLOGY,73999000,JKHY,36.67
51,155.9,165.39,180.81,111.02,"5 HANOVER QUAY, GRAND CANAL DOCK, DUBLIN, IE",183.92,Common Stock,2.065,30.66,1521332,USA,USD,"Aptiv plc is an auto parts company headquartered in Dublin, Ireland.",2.941,2020-02-19,0,0,2178000000,2.941,21.8,3.019,2020-02-04,NYSE,December,34.72,1950000000,MOTOR VEHICLE PARTS & ACCESSORIES,,2021-09-30,46887432000,Aptiv PLC,,0.089,1.498,58.11,5.51,2.987,0.0547,-0.697,-0.004,0.0512,0.11,58.06,15696000000,MANUFACTURING,270514000,APTV,58.11
52,42.74,42.43,47.05,28.53,"9601 S. MERIDIAN BLVD., ENGLEWOOD, CO, US",50.83,Common Stock,2.058,28.28,1001082,USA,USD,"DISH Network Corporation is an American television provider and the owner of the direct-broadcast satellite provider DISH, commonly known as DISH Network, and the over-the-top IPTV service, Sling TV.",4.159,2012-12-28,None,0,4229249000,4.159,7.29,1.721,2012-12-12,NASDAQ,December,11.71,5459707000,CABLE & OTHER PAY TELEVISION SERVICES,,2021-09-30,19322061000,DISH Network Corporation,,0.193,1.46,8.79,1.283,1.074,0.144,0.023,-0.018,0.0562,0.185,34.13,17991813000,TECHNOLOGY,290357000,DISH,8.79
53,427.05,515.21,558.97,302.44,"7501 W. MEMORIAL ROAD, OKLAHOMA CITY, OK, US",562.63,Common Stock,1.395,14.23,1590955,USA,USD,"Paycom Software, Inc., known simply as Paycom, is an American online payroll and human resource technology provider based in Oklahoma City, Oklahoma.",2.95,None,None,0,256642000,2.95,102.04,29.34,None,NYSE,December,86.96,743656000,SERVICES-PREPACKAGED SOFTWARE,,2021-09-30,29480276000,Paycom Software Inc,,0.223,3.058,165.27,35.49,29.73,0.173,0.106,0.304,0.0413,0.235,17.16,991485000,TECHNOLOGY,60026000,PAYC,165.27
54,164.96,155.64,181.65,130.75,"ONE PPG PL 40 EAST, PITTSBURGH, PA, US",177.3,Common Stock,1.149,26.34,79879,USA,USD,"PPG Industries, Inc. is an American Fortune 500 company and global supplier of paints, coatings, and specialty materials. With headquarters in Pittsburgh, Pennsylvania, PPG operates in more than 70 countries around the globe.",5.95,2021-12-10,2.21,0.0139,2511000000,5.95,17.45,2.704,2021-11-09,NYSE,December,19.34,6091000000,"PAINTS, VARNISHES, LACQUERS, ENAMELS & ALLIED PRODS",,2021-09-30,38190694000,PPG Industries Inc,,0.121,2.261,27.03,6.06,2.333,0.0871,-0.231,0.186,0.0614,0.243,68.89,16369000000,LIFE SCIENCES,237401000,PPG,27.03
55,181.79,184.9,203.82,124.79,"200 N MILWAUKEE AVENUE, VERNON HILLS, IL, US",206.13,Common Stock,1.106,6.14,1402057,USA,USD,"CDW Corporation, headquartered in Lincolnshire, Illinois, is a provider of technology products and services for business, government and education.",7.12,2021-12-10,1.6,0.0085,1637000000,7.12,17.89,1.474,2021-11-23,NASDAQ,December,21.98,3210100000,RETAIL-CATALOG & MAIL-ORDER HOUSES,,2021-09-30,25827410000,CDW Corporation,,0.0702,1.53,26.74,30.54,1.276,0.05,0.436,0.114,0.0974,0.975,144.29,20240099000,TRADE & SERVICES,135723000,CDW,26.74
56,174.84,184.6,197.92,142.04,"BARENGASSE 32, ZURICH, CH",203.88,Common Stock,0.795,137.67,896159,USA,USD,"Chubb Limited, incorporated in Zurich, Switzerland, is the parent company of Chubb, a global provider of insurance products covering property and casualty, accident and health, reinsurance, and life insurance and the largest publicly traded property and casualty company in the world.",19.67,2021-10-08,3.16,0.0164,8147000000,19.67,-,2.483,2021-09-16,NYSE,December,13.64,7110000000,"FIRE, MARINE & CASUALTY INSURANCE",,2021-09-30,83064095000,Chubb Limited,,0.195,0.874,9.8,1.402,2.057,0.218,0.589,0.14,0.0254,0.152,90.62,40372998000,FINANCE,430741000,CB,9.8
57,79.69,76.17,84.48,72.89,"300 PARK AVE, NEW YORK, NY, US",84.45,Common Stock,0.571,0.701,21665,USA,USD,"Colgate-Palmolive Company is an American multinational consumer products company headquartered on Park Avenue in Midtown Manhattan, New York City. It specializes in the production, distribution and provision of household, health care, personal care and veterinary products.",3.14,2021-11-15,1.78,0.0228,4407000000,3.14,16.34,4.179,2021-10-20,NYSE,December,23.15,10021000000,"PERFUMES, COSMETICS & OTHER TOILET PREPARATIONS",,2021-09-30,66049864000,Colgate-Palmolive Company,,0.222,3.916,24.96,111.22,3.809,0.154,-0.074,0.063,0.154,428.46,20.45,17341999000,LIFE SCIENCES,842849000,CL,24.96
58,724.74,713.76,825.62,585.45,"12405 POWERSCOURT DRIVE, ST. LOUIS, MO, US",798.89,Common Stock,0.963,94.98,1091667,USA,USD,"Charter Communications, Inc., is an American telecommunications and mass media company with services branded as Charter Spectrum.",21.94,None,None,0,20029000000,21.94,10.95,4.162,None,NASDAQ,December,21.1,21198000000,CABLE & OTHER PAY TELEVISION SERVICES,,2021-09-30,123594252000,Charter Communications Inc,,0.207,0.557,31.42,7.31,2.419,0.084,0.667,0.092,0.046,0.177,270.34,51094000000,TECHNOLOGY,179291000,CHTR,31.42
59,175.84,164.94,202.76,133.11,"20 SYLVAN ROAD, WOBURN, MA, US",205.21,Common Stock,1.089,32.06,4127,USA,USD,"Skyworks Solutions, Inc. is an American semiconductor company headquartered in Irvine, California, United States. Skyworks manufactures semiconductors for use in Radio Frequency (RF) and mobile communications systems.",8.97,2021-12-14,2.06,0.0127,2076000000,8.97,13.65,5.47,2021-11-22,NASDAQ,September,13.99,2530100000,SEMICONDUCTORS & RELATED DEVICES,,2021-09-30,27001207000,Skyworks Solutions Inc,,0.321,1.134,18.23,5.05,5.28,0.293,0.323,0.37,0.15,0.317,30.93,5109100000,MANUFACTURING,165145000,SWKS,18.23
60,92.9,101.35,107.88,56.56,"400 SOUTH HOPE STREET, 25TH FLOOR, LOS ANGELES, CA, US",123.33,Common Stock,1.403,24.28,1138118,USA,USD,"CBRE Group, Inc. is an American commercial real estate services and investment firm. The abbreviation CBRE stands for Coldwell Banker Richard Ellis. It is the largest commercial real estate services company in the world.",4.29,None,None,0,2461770000,4.29,15.03,1.417,None,NYSE,December,23.98,4828075000,REAL ESTATE,,2021-09-30,35213554000,CBRE Group Inc,,0.0631,1.144,24.53,4.429,1.349,0.0559,1.331,0.204,0.0571,0.195,77.8,26106321000,REAL ESTATE & CONSTRUCTION,334666000,CBRE,24.53
61,180.86,183.43,210.16,133.7,"1200 URBAN CENTER DRIVE, BIRMINGHAM, AL, US",218.25,Common Stock,0.648,48.42,1396009,USA,USD,"Vulcan Materials Company (NYSE: VMC) is an American company based in Birmingham, Alabama. It is principally engaged in the production, distribution and sale of construction materials.",4.85,2021-12-02,1.45,0.0073,1341979000,4.85,21.77,6.02,2021-11-15,NYSE,December,30.67,1281481000,MINING & QUARRYING OF NONMETALLIC MINERALS (NO FUELS),,2021-09-30,26843568000,Vulcan Materials Company,,0.18,1.395,41.71,4.115,5.24,0.126,-0.114,0.158,0.0455,0.105,38.58,5121016000,ENERGY & TRANSPORTATION,132705000,VMC,41.71
62,196.82,182.2,223.34,166.85,"1000 STANLEY DR, P O BOX 7000, NEW BRITAIN, CT, US",216.93,Common Stock,1.381,70.97,93556,USA,USD,"Stanley Black & Decker, Inc., formerly known as The Stanley Works, is a Fortune 500 American manufacturer of industrial tools and household hardware and provider of security products. Headquartered in the greater Hartford city of New Britain, Connecticut, Stanley Black & Decker is the result of the merger of Stanley Works and Black & Decker on March 12, 2010.",11.24,2021-12-21,2.89,0.0152,3151100000,11.24,11.64,2.045,2021-11-30,NYSE,December,16,5039100000,"CUTLERY, HANDTOOLS & GENERAL HARDWARE",,2021-09-30,32039959000,Stanley Black & Decker Inc,,0.15,1.368,17.49,2.74,1.866,0.106,0.049,0.107,0.0679,0.168,108.64,17168800000,MANUFACTURING,162962000,SWK,17.49
63,147.09,158.82,168.5,111.73,"TWO PIERCE PLACE, ITASCA, IL, US",174.36,Common Stock,0.684,40.62,354190,USA,USD,"Arthur J. Gallagher & Co. (AJG) is an American global insurance brokerage and risk management services firm headquartered in Rolling Meadows, Illinois.",4.622,2021-12-17,1.89,0.0116,1887900000,4.622,20.88,4.631,2021-12-02,NYSE,December,28.74,2510500000,"INSURANCE AGENTS, BROKERS & SERVICE",,2021-09-30,34352181000,Arthur J. Gallagher & Co,,0.179,2.09,35.86,4.005,4.449,0.122,0.178,0.165,0.0356,0.138,38.81,7721700000,FINANCE,207278000,AJG,35.86
64,101.45,115.89,124.69,66.45,"2800 POST OAK BLVD, SUITE 2600, HOUSTON, TX, US",133.75,Common Stock,1.166,33.29,1050915,USA,USD,"Quanta Services is an American corporation that provides infrastructure services for electric power, pipeline, industrial and communications industries. Capabilities include the planning, design, installation, program management, maintenance and repair of most types of network infrastructure.",3.809,2021-10-15,0.24,0.0021,1013623000,3.809,17.06,1.513,2021-09-30,NYSE,December,18.59,1660847000,ELECTRICAL WORK,,2021-09-30,16615384000,Quanta Services Inc,,0.0568,0.75,30.61,3.586,1.388,0.0461,0.071,0.11,0.0447,0.127,85.33,11968860000,REAL ESTATE & CONSTRUCTION,142499000,PWR,30.61
65,75.79,72.14,142,55.65,"825 BERKSHIRE BLVD STE 200, WYOMISSING PROFESSIONAL CENTER, WYOMISSING, PA, US",87.06,Common Stock,2.438,19.46,921738,USA,USD,"Penn National Gaming, Inc. is an American operator of casinos and racetracks, based in Wyomissing, Pennsylvania.",2.359,None,None,0,1317700000,2.359,13.4,3.5,None,NASDAQ,December,19.46,1710700000,HOTELS & MOTELS,,2021-09-30,9874190000,Penn National Gaming Inc,,0.183,-15.89,24.69,3.238,1.842,0.0722,-0.442,0.338,0.0401,0.136,34.41,5359900000,REAL ESTATE & CONSTRUCTION,169514000,PENN,24.69
66,72.5,73.94,79.58,64.39,"6920 SEAWAY BLVD., EVERETT, WA, US",85.31,Common Stock,1.209,25.98,1659166,USA,USD,"Fortive is an American diversified industrial technology conglomerate company headquartered in Everett, Washington.",4.584,2021-12-30,0.28,0.0036,1284100000,4.584,13.08,5.76,2021-11-24,NYSE,December,25.77,2616700000,"INDUSTRIAL INSTRUMENTS FOR MEASUREMENT, DISPLAY, AND CONTROL",,2021-09-30,28058726000,Fortive Corporation,,0.173,1.655,17.07,2.987,5.39,0.319,-0.313,0.12,0.035,0.2,15.14,5203300000,LIFE SCIENCES,358578000,FTV,17.07
67,87.83,106.47,117.2,33.99,"500 WEST TEXAS, SUITE 1210, MIDLAND, TX, US",127.79,Common Stock,2.561,63.52,1539838,USA,USD,"Diamondback Energy is a company engaged in hydrocarbon exploration and headquartered in Midland, Texas.",2.561,2021-11-18,1.75,0.0161,3015000000,2.561,12.7,4.73,2021-11-10,NASDAQ,December,5.87,2001000000,CRUDE PETROLEUM & NATURAL GAS,,2021-09-30,19920191000,Diamondback Energy Inc,,0.341,0.207,42.93,1.716,3.791,0.0839,0.421,1.652,0.0541,0.0406,30.72,5255000000,ENERGY & TRANSPORTATION,181175000,FANG,42.93
68,230.32,210.2,270.64,200.47,"ONE AMGEN CENTER DRIVE, THOUSAND OAKS, CA, US",244.62,Common Stock,0.608,14.54,318154,USA,USD,"Amgen Inc. (formerly Applied Molecular Genetics Inc.) is an American multinational biopharmaceutical company headquartered in Thousand Oaks, California. Focused on molecular biology and biochemistry, its goal is to provide a healthcare business based on recombinant DNA technology.",9.7,2021-12-08,6.88,0.0325,12133000000,9.7,13.02,5.58,2021-11-15,NASDAQ,December,11.78,19265000000,"BIOLOGICAL PRODUCTS, (NO DISGNOSTIC SUBSTANCES)",,2021-09-30,119068795000,Amgen Inc,,0.344,1.599,21.79,14.5,4.621,0.218,-0.035,0.044,0.0856,0.585,44.89,25767000000,LIFE SCIENCES,563266000,AMGN,21.79
69,185.71,178.91,206.44,135.73,"170/175 LAKEVIEW DRIVE, AIRSIDE BUSINESS PARK, SWORDS,, CO. DUBLIN, IE",201.53,Common Stock,1.241,27.26,1466258,USA,USD,"Trane Technologies plc is an American Irish domiciled diversified industrial manufacturing company. It is headquartered near Dublin, Ireland.",5.56,2021-12-31,2.3,0.0122,2234100000,5.56,20.84,3.413,2021-12-02,NYSE,December,26.95,3827500000,AUTO CONTROLS FOR REGULATING RESIDENTIAL & COMML ENVIRONMENTS,,2021-09-30,45823840000,Trane Technologies plc,,0.145,2.121,34.68,6.92,3.334,0.0982,0.017,0.064,0.0689,0.214,57.4,13746200000,LIFE SCIENCES,237540000,TT,34.68
70,84.3,85.36,96.49,56.01,"935 STEWART DRIVE, SUNNYVALE, CA, US",96.33,Common Stock,1.541,15.46,864749,USA,USD,"Trimble Inc. is a Sunnyvale, California-based hardware, software and services technology company. Trimble services global industries in Agriculture, Building & Construction, Geospatial, Natural Resources and Utilities, Governments, Transportation and others. Trimble also does hardware development of Global Navigation Satellite System (GNSS) receivers, scanners, laser rangefinders, unmanned aerial vehicles (UAVs), inertial navigation systems and software processing tools.",2.197,None,None,0,772300000,2.197,26.78,6.28,None,NASDAQ,December,28.9,1850100000,"MEASURING & CONTROLLING DEVICES, NEC",,2021-09-30,21759883000,Trimble Inc,,0.165,2.887,39.46,5.53,6.11,0.157,0.45,0.138,0.054,0.154,14.18,3562800000,LIFE SCIENCES,251008000,TRMB,39.46
71,337.46,363.27,414.99,207.84,"100 FIRST STAMFORD PLACE, 7TH FLOOR, STAMFORD, CT, US",391.47,Common Stock,1.942,75.74,1067701,USA,USD,"United Rentals, Inc. (NYSE: URI) is the world's largest equipment rental company, with about 13 percent of the North American market share as of 2019.",16.53,None,None,0,2468000000,16.53,9.58,4.131,None,NYSE,December,15.48,3232000000,"SERVICES-EQUIPMENT RENTAL & LEASING, NEC",,2021-09-30,27840715000,United Rentals Inc,,0.227,1.29,23.26,5.05,3.02,0.13,0.962,0.187,0.0685,0.249,127.38,9219000000,TRADE & SERVICES,72394000,URI,23.26
72,116.08,118.34,126.73,86.54,"50 S LASALLE ST, CHICAGO, IL, US",131.03,Common Stock,1.174,53.04,73124,USA,USD,"Northern Trust Corporation is a financial services company headquartered in Chicago, Illinois that caters to corporations, institutional investors, and ultra high net worth individuals.",6.34,2022-01-01,2.8,0.0225,None,6.34,-,-,2021-12-09,NASDAQ,December,16.84,5975800000,STATE COMMERCIAL BANKS,,2021-09-30,25819009000,Northern Trust Corporation,,0.301,1.186,19.61,2.349,4.039,0.216,0.364,0.109,0.0086,0.117,30.7,6391900000,FINANCE,207661000,NTRS,19.61
73,155.69,157.19,163.16,126.63,"385 WASHINGTON ST, SAINT PAUL, MN, US",164,Common Stock,0.765,115.75,86312,USA,USD,"The Travelers Companies, Inc., commonly known as Travelers, is an American insurance company.",14.28,2021-12-31,3.46,0.0219,5633000000,14.28,-,1.325,2021-12-09,NYSE,December,12.82,8085000000,"FIRE, MARINE & CASUALTY INSURANCE",,2021-09-30,38844817000,The Travelers Companies Inc,,0.139,1.134,11.06,1.379,1.136,0.106,-0.189,0.064,0.0251,0.129,136.29,34201999000,FINANCE,246009000,TRV,11.06
74,221.6,209.3,254.57,168.17,"WHIRLPOOL CNTR 2000 M 63, C/O CORPORATE SECRETARY, BENTON HARBOR, MI, US",255.67,Common Stock,1.768,81.38,106640,USA,USD,"The Whirlpool Corporation is an American multinational manufacturer and marketer of home appliances, headquartered in Benton Charter Township, Michigan, United States.",31.35,2021-12-15,5.3,0.0236,3153000000,31.35,5.22,0.768,2021-11-18,NYSE,December,10.98,3850000000,HOUSEHOLD APPLIANCES,,2021-09-30,14102726000,Whirlpool Corporation,,0.119,1.649,7.41,2.753,0.642,0.0906,0.213,0.037,0.0804,0.428,349.95,21967999000,MANUFACTURING,60743000,WHR,7.41
75,247.09,244.33,264.69,223.11,"1 BECTON DRIVE, FRANKLIN LAKES, NJ, UNITED STATES",269.64,Common Stock,0.711,82.79,10795,USA,USD,"Becton, Dickinson and Company, also known as BD, is an American multinational medical technology company that manufactures and sells medical devices, instrument systems, and reagents. BD also provides consulting and analytics services in certain geographies.",6.85,2021-12-31,3.32,0.0136,5412000000,6.85,17.19,4.231,2021-12-09,NYSE,September,18.9,9483000000,SURGICAL & MEDICAL INSTRUMENTS & APPARATUS,,2021-09-30,69844607000,Becton Dickinson and Company,,0.155,1.736,35.5,2.972,3.45,0.103,1.408,0.073,0.0364,0.0882,69.99,20248001000,LIFE SCIENCES,287190000,BDX,35.5
76,55.87,52.43,61.27,42.83,"6400 POPLAR AVENUE, MEMPHIS, TN, US",57.36,Common Stock,0.96,24.85,51434,USA,USD,"The International Paper Company (NYSE: IP) is an American pulp and paper company, the largest such company in the world. The company is headquartered in Memphis, Tennessee.",4.541,2021-12-15,2.05,0.0413,3216000000,4.541,7.76,1.283,2021-11-12,NYSE,December,10.08,6207000000,PAPER MILLS,,2021-09-30,19343788000,International Paper Company,,0.0902,1.39,11.0,2.018,0.882,0.082,3.239,0.115,0.0403,0.215,56.01,21931999000,MANUFACTURING,387263000,IP,11.0
77,119.84,121.95,129.54,93.8,"1 WEST FIRST AVENUE, CONSHOHOCKEN, PA, UNITED STATES",144.08,Common Stock,0.485,2.811,1140859,USA,USD,AmerisourceBergen Corporation is an American drug wholesale company that was formed by the merger of Bergen Brunswig and AmeriSource in 2001.,7.39,2021-11-29,1.76,0.0141,3348977000,7.39,10.43,0.141,2021-11-12,NYSE,September,11.92,6943228000,"WHOLESALE-DRUGS, PROPRIETARIES & DRUGGISTS' SUNDRIES",,2021-09-30,26044023000,AmerisourceBergen Corporation,,0.0133,1.543,16.96,44.69,0.122,0.0072,-0.007,0.196,0.035,-99999.99,1039.19,213988835000,TRADE & SERVICES,207787000,ABC,16.96
78,39.12,36.89,43.84,30.03,"ONE PPG PLACE, PITTSBURGH, PA, US",40.69,Common Stock,1.056,40.82,1637459,USA,USD,"The Kraft Heinz Company (KHC), commonly known as Kraft Heinz, is an American food company formed by the merger of Kraft Foods and Heinz, co-headquartered in Chicago, Illinois, and Pittsburgh, Pennsylvania.",1.858,2021-12-17,1.6,0.0429,6705000000,1.858,10.85,2.565,2021-11-24,NASDAQ,December,14.29,9171000000,"CANNED, FROZEN & PRESERVD FRUIT, VEG & FOOD SPECIALTIES",,2021-09-30,45604180000,The Kraft Heinz Company,,0.22,3.098,20.03,0.912,1.736,0.0876,0.209,-0.018,0.0374,0.0465,21.45,26272000000,MANUFACTURING,1225260000,KHC,20.03
79,35.83,38.3,41.85,25.88,"1211 AVENUE OF THE AMERICAS, NEW YORK, NY, US",51.5,Common Stock,1.106,20.03,1754301,USA,USD,Fox Corporation is an American mass media company headquartered in New York City.,2.958,2021-09-29,0.47,0.0123,2985000000,2.958,8.32,1.947,2021-08-31,NASDAQ,June,13.51,4872000000,TELEVISION BROADCASTING STATIONS,,2021-09-30,22678475000,Fox Corporation,,0.2,15.17,12.9,1.905,1.713,0.132,-0.339,0.121,0.0726,0.157,22.67,13237000000,TECHNOLOGY,249240000,FOX,12.9
80,44.52,45.25,48.93,23.89,"ONE FEDERAL STREET, BOSTON, MA, US",43.13,Common Stock,0.823,3.363,1020569,USA,USD,"Iron Mountain Inc. (NYSE: IRM) is an American enterprise information management services company founded in 1951 and headquartered in Boston, Massachusetts.",2.197,2022-01-06,2.474,0.0517,1491800000,2.197,13.11,5.69,2021-12-14,NYSE,December,35.46,2397576000,REAL ESTATE INVESTMENT TRUSTS,,2021-09-30,13768103000,Iron Mountain Incorporated,,0.196,1.08,21.64,14.23,3.135,0.145,0.769,0.09,0.0386,0.626,15.19,4391597000,REAL ESTATE & CONSTRUCTION,289550000,IRM,21.64
81,98.52,96.34,105.21,71.6,"120 PARK AVENUE, NEW YORK, NY, US",110.22,Common Stock,0.859,-7.2,1413329,USA,USD,"Philip Morris International Inc. (PMI) is a Swiss-American multinational cigarette and tobacco manufacturing company, with products sold in over 180 countries. The most recognized and best selling product of the company is Marlboro.",5.74,2021-10-14,4.85,0.0511,14061000000,5.74,12.39,5.61,2021-09-28,NYSE,December,14.39,19125000000,CIGARETTES,,2021-09-30,148288045000,Philip Morris International Inc,,0.425,1.378,16.59,-,4.823,0.292,0.049,0.091,0.202,-99999.99,19.74,30745000000,MANUFACTURING,1556830000,PM,16.59
82,26.23,27.99,29.89,18.31,"ONE WILLIAMS CTR, TULSA, OK, US",30.61,Common Stock,1.463,9.2,107263,USA,USD,"The Williams Companies, Inc., is an American energy company based in Tulsa, Oklahoma. Its core business is natural gas processing and transportation, with additional petroleum and electricity generation assets.",0.82,2021-12-27,1.63,0.0564,4223000000,0.82,12.74,5.7,2021-12-09,NYSE,December,22.17,4780000000,NATURAL GAS TRANSMISSION,,2021-09-30,35011092000,The Williams Companies Inc,,0.254,2.257,35.14,3.064,3.7,0.107,-0.48,0.28,0.0332,0.0736,7.79,9462000000,ENERGY & TRANSPORTATION,1215030000,WMB,35.14
83,467.49,469.56,505,363.83,"6901 PROFESSIONAL PKWY EAST, SUITE 200, SARASOTA, FL, US",520.64,Common Stock,1.056,107.53,882835,USA,USD,"Roper Technologies, Inc. (formerly Roper Industries, Inc.) is an American diversified industrial company that produces engineered products for global niche markets. The company is headquartered in Sarasota, Florida.",10.54,2021-10-20,2.25,0.0047,2292400000,10.54,25.1,9.33,2022-01-07,NYSE,December,31.45,3543000000,"INDUSTRIAL INSTRUMENTS FOR MEASUREMENT, DISPLAY, AND CONTROL",,2021-09-30,51448201000,Roper Technologies Inc,,0.263,2.51,46.29,4.458,8.2,0.179,0.226,0.221,0.0434,0.105,59.68,6274000000,LIFE SCIENCES,105485000,ROP,46.29
84,119.59,112.23,133.57,104.92,"4440 ROSEWOOD DRIVE, PLEASANTON, CA, US",138.47,Common Stock,1.026,10.98,745732,USA,USD,"Ross Stores, Inc., operating under the brand name Ross Dress for Less, is an American chain of discount department stores headquartered in Dublin, California.",3.763,2021-09-30,0.855,0.0074,2484895000,3.763,18.3,2.372,2021-09-03,NASDAQ,February,21.46,3534366000,RETAIL-FAMILY CLOTHING STORES,,2021-08-31,41069650000,Ross Stores Inc,,0.123,0.217,30.71,10.51,2.37,0.0773,22.17,0.79,0.106,0.396,49.12,17325234000,TRADE & SERVICES,355366000,ROST,30.71
85,188.6,176.28,203.18,142.93,"1220 AUGUSTA DRIVE, SUITE 600, HOUSTON, TX, US",198.76,Common Stock,0.431,19.7,1051470,USA,USD,"Crown Castle is a real estate investment trust and provider of shared communications infrastructure in the United States. Its network includes over 40,000 cell towers and nearly 80,000 route miles of fiber supporting small cells and fiber solutions. Headquartered in Houston, Texas, the company has 100 offices nationwide.",2.871,2021-12-31,5.32,0.0294,3465000000,2.871,28.99,16.9,2021-12-14,NYSE,December,53.48,3891000000,REAL ESTATE INVESTMENT TRUSTS,,2021-09-30,78133658000,Crown Castle International Corp. (REIT),,0.306,3.578,62.97,9.17,12.64,0.203,1.132,0.089,0.0304,0.146,14.3,6179000000,REAL ESTATE & CONSTRUCTION,432203000,CCI,62.97
