,200DayMovingAverage,50DayMovingAverage,52WeekHigh,52WeekLow,Address,AnalystTargetPrice,AssetType,Beta,BookValue,CIK,Country,Currency,Description,DilutedEPSTTM,DividendDate,DividendPerShare,DividendYield,EBITDA,EPS,EVToEBITDA,EVToRevenue,ExDividendDate,Exchange,FiscalYearEnd,ForwardPE,GrossProfitTTM,Industry,Information,LatestQuarter,MarketCapitalization,Name,Note,OperatingMarginTTM,PEGRatio,PERatio,PriceToBookRatio,PriceToSalesRatioTTM,ProfitMargin,QuarterlyEarningsGrowthYOY,QuarterlyRevenueGrowthYOY,ReturnOnAssetsTTM,ReturnOnEquityTTM,RevenuePerShareTTM,RevenueTTM,Sector,SharesOutstanding,Symbol,TrailingPE
202,109.7,111.66,125.42,72.43,"200 MADISON AVENUE, NEW YORK, NY, US",129.89,Common Stock,2.286,70.45,78239,USA,USD,"PVH Corp., formerly known as the Phillips-Van Heusen Corporation, is an American clothing company which owns brands such as Van Heusen, Tommy Hilfiger, Calvin Klein, IZOD, Arrow, Warner's, Olga, True & Co., and Geoffrey Beene.",4.081,2021-12-17,0,0,979600000,4.081,12.71,1.405,2021-11-23,NYSE,February,12.3,3776800000,"MEN'S & BOYS' FURNISHGS, WORK CLOTHG, & ALLIED GARMENTS",,2021-08-31,8542522000,PVH Corp,,0.0777,4.584,29.46,1.72,0.993,0.0342,-0.652,0.463,0.0321,0.0609,120.71,8600400000,MANUFACTURING,71052000,PVH,29.46
203,89.11,101.83,127.75,64.92,"9348 CIVIC CENTER DRIVE, BEVERLY HILLS, CA, US",110.67,Common Stock,1.291,5.39,1335258,USA,USD,"Live Nation Entertainment, Inc is an American global entertainment company, founded in 2010, following the merger of Live Nation and Ticketmaster. The company promotes, operates, and manages ticket sales for live entertainment in the United States and internationally. It also owns and operates entertainment venues, and manages the careers of music artists.",-4.165,None,None,0,657285000,-4.165,18.29,7.45,None,NYSE,December,312.5,458778000,SERVICES-AMUSEMENT & RECREATION SERVICES,,2021-09-30,25233811000,Live Nation Entertainment Inc,,-0.184,2.65,None,31.01,6.64,-0.236,0.011,13.67,-0.0361,-2.412,17.67,3802660000,TRADE & SERVICES,224660000,LYV,-
204,798.06,796.87,885.26,582.34,"ONE LAGOON DRIVE, REDWOOD CITY, CA, US",890.04,Common Stock,0.338,117.38,1101239,USA,USD,"Equinix, Inc. is an American multinational company headquartered in Redwood City, California, that specializes in Internet connection and data centers.",4.743,2021-12-15,11.27,0.0145,2775003000,4.743,33.49,12.85,2021-11-16,NASDAQ,December,90.09,2888768000,REAL ESTATE INVESTMENT TRUSTS,,2021-09-30,69916991000,Equinix Inc. (REIT),,0.177,3.818,163.72,6.6,10.69,0.0654,1.27,0.112,0.0268,0.0405,73.11,6542705000,REAL ESTATE & CONSTRUCTION,90041000,EQIX,163.72
205,415.18,428.33,466,316.94,"UNITEDHEALTH GROUP CENTER, 9900 BREN ROAD EAST, MINNEAPOLIS, MN, US",474.55,Common Stock,0.85,74.61,731766,USA,USD,"UnitedHealth Group Incorporated is an American for-profit multinational managed healthcare and insurance company based in Minnetonka, Minnesota. It offers health care products and insurance services. In 2020, it was the second-largest healthcare company (behind CVS Health) by revenue with $257.1 billion, and the largest insurance company by net premiums. UnitedHealthcare revenues comprise 80% of the Group's overall revenue.",16.11,2021-12-14,5.4,0.0118,24196000000,16.11,18.15,1.636,2021-12-03,NYSE,December,21.19,67000000000,HOSPITAL & MEDICAL SERVICE PLANS,,2021-09-30,432300196000,UnitedHealth Group Incorporated,,0.0786,1.677,28.49,6.13,1.548,0.0552,0.297,0.111,0.0679,0.22,295.5,279320986000,FINANCE,941851000,UNH,28.49
206,132.79,127.45,142.54,111.81,"488 8TH AVENUE, P O BOX 129400, SAN DIEGO, CA, US",147.26,Common Stock,0.652,74.19,1032208,USA,USD,"Sempra Energy is a North American energy infrastructure company based in San Diego, California. Sempra Energy's focus is on electric and natural gas infrastructure. Its operating companies include: Southern California Gas Company (SoCalGas) and San Diego Gas & Electric (SDG&E) in Southern California; Oncor Electric Delivery Company (Oncor) in Texas; Sempra LNG; and IEnova, based in Mexico.",3.486,2021-10-15,4.34,0.0357,4351000000,3.486,22.01,5.33,2021-09-23,NYSE,December,14.31,4499000000,GAS & OTHER SERVICES COMBINED,,2021-09-30,38991045000,Sempra,,0.21,2.216,35.03,1.639,3.2,0.0955,-0.82,0.14,0.0232,0.0478,40.05,12184001000,ENERGY & TRANSPORTATION,319337000,SRE,35.03
207,122.16,123.43,135.17,73.1,"2500 LAKE COOK ROAD, RIVERWOODS, IL, US",141.21,Common Stock,1.713,41.41,1393612,USA,USD,"Discover Financial Services is an American financial services company that owns and operates Discover Bank, which offers checking and savings accounts, personal loans, home equity loans, student loans and credit cards. It also owns and operates the Discover and Pulse networks, and owns Diners Club International. Discover is currently headquartered in the Chicago suburb of Riverwoods, Illinois.",16.72,2021-12-09,1.82,0.0154,None,16.72,-,-,2021-11-23,NYSE,December,8.9,5414000000,PERSONAL CREDIT INSTITUTIONS,,2021-09-30,34780795000,Discover Financial Services,,0.601,0.397,7.1,2.845,3.027,0.451,0.445,0.32,0.0445,0.441,37.79,11489000000,FINANCE,293076000,DFS,7.1
208,72.3,77.31,84.38,58.21,"358 HALL AVE, WALLINGFORD, CT, US",82.43,Common Stock,1.248,9.95,820313,USA,USD,"Amphenol Corporation is a major producer of electronic and fiber optic connectors, cable and interconnect systems such as coaxial cables. Amphenol is a portmanteau from the corporation's original name, American Phenolic Corp.",2.38,2022-01-12,0.58,0.007,2425200000,2.38,22.61,5.2,2021-12-20,NYSE,December,30.12,2664100000,ELECTRONIC CONNECTORS,,2021-09-30,50198475000,Amphenol Corporation,,0.201,2.061,35.27,8.33,4.885,0.144,0.218,0.213,0.0965,0.267,17.18,10275500000,MANUFACTURING,598028000,APH,35.27
209,81.07,84.1,88.08,54.22,"EQUITY RESIDENTIAL, TWO NORTH RIVERSIDE PLAZA, SUITE 400, CHICAGO, IL, US",89.23,Common Stock,0.799,28.33,906107,USA,USD,Equity Residential is a publicly traded real estate investment trust that invests in apartments.,2.823,2021-10-08,2.41,0.028,1441041000,2.823,18.28,16.66,2021-09-24,NYSE,December,74.07,1655320000,REAL ESTATE INVESTMENT TRUSTS,,2021-09-30,32416383000,Equity Residential,,0.256,4.696,30.62,3.017,13.33,0.435,3.718,0.001,0.0189,0.0982,6.52,2432302000,REAL ESTATE & CONSTRUCTION,375016000,EQR,30.62
210,19.04,18.91,23.0,13.37,"1020 HULL STREET, 3RD FLOOR, BALTIMORE, MD, US",26.2,Common Stock,1.285,4.154,1336917,USA,USD,"Under Armour, Inc. is an American sports equipment company that manufactures footwear, sports and casual apparel. Under Armour's global headquarters are located in Baltimore, Maryland.",0.945,None,None,0,691838000,0.945,44.7,2.007,None,NYSE,December,33.0,2172471000,APPAREL & OTHER FINISHD PRODS OF FABRICS & SIMILAR MATL,,2021-09-30,10944011000,Under Armour Inc,,0.0977,4.461,22.51,5.09,1.969,0.0782,1.801,0.079,0.0701,0.252,12.08,5558027000,MANUFACTURING,253019000,UA,22.51
211,61.4,55.63,74.04,52.75,"6363 SOUTH FIDDLERS GREEN CIRCLE, GREENWOOD VILLAGE, CO, US",99.78,Common Stock,0.235,28.46,1164727,USA,USD,"Newmont Corporation, based in Greenwood Village, Colorado, United States, is one of the largest gold mining companies in the world.",2.537,2021-12-28,2.2,0.0374,6045000000,2.537,9.43,3.961,2021-12-08,NYSE,December,21.19,6159000000,GOLD AND SILVER ORES,,2021-09-30,46833357000,Newmont Corporation,,0.304,0.787,23.15,2.066,3.835,0.167,-0.996,-0.087,0.0578,0.0725,15.25,12213000000,ENERGY & TRANSPORTATION,797435000,NEM,23.15
212,138.32,135.95,169.52,121.8,"5775 MOREHOUSE DR, SAN DIEGO, CA, US",187.39,Common Stock,1.331,8.84,804328,USA,USD,"Qualcomm is an American multinational corporation headquartered in San Diego, California, and incorporated in Delaware. It creates semiconductors, software, and services related to wireless technology. It owns patents critical to the 5G, 4G, CDMA2000, TD-SCDMA and WCDMA mobile communications standards.",7.87,2021-12-16,2.66,0.0162,11371000000,7.87,15.1,5.59,2021-12-01,NASDAQ,September,15.55,19304000000,RADIO & TV BROADCASTING & COMMUNICATIONS EQUIPMENT,,2021-09-30,184732795000,QUALCOMM Incorporated,,0.292,1.053,20.96,18.51,5.5,0.269,-0.049,0.119,0.159,1.129,29.68,33565999000,MANUFACTURING,1120000000,QCOM,20.96
213,218.36,216.37,238.87,172.47,"100 MISSION RIDGE, GOODLETTSVILLE, TN, US",249.88,Common Stock,0.501,26.3,29534,USA,USD,"Dollar General Corporation is an American chain of variety stores headquartered in Goodlettsville, Tennessee.",10.43,2021-10-19,1.56,0.007,4014774000,10.43,16.27,1.938,2021-10-04,NYSE,January,20.04,10718862000,RETAIL-VARIETY STORES,,2021-07-31,52389761000,Dollar General Corporation,,0.101,2.294,21.53,8.41,1.556,0.0752,-0.138,-0.004,0.083,0.375,139.68,33665311000,TRADE & SERVICES,233310000,DG,21.53
214,331.79,355.16,419.33,233.9,"ONE TECHNOLOGY DRIVE, MILPITAS, CA, US",410.25,Common Stock,1.224,25.44,319201,USA,USD,"KLA Corporation is a capital equipment company based in Milpitas, California. It supplies process control and yield management systems for the semiconductor industry and other related nanoelectronics industries. The company's products and services are intended for all phases of wafer, reticle, integrated circuit (IC) and packaging production, from research and development to final volume manufacturing.",17.62,2021-12-01,3.75,0.0091,3113245000,17.62,20.24,8.51,2021-11-12,NASDAQ,June,19.76,4146569000,OPTICAL INSTRUMENTS & LENSES,,2021-09-30,63227892000,KLA Corporation,,0.372,1.774,23.67,16.21,8.47,0.365,1.587,0.354,0.17,0.823,48.67,7463952000,LIFE SCIENCES,151622000,KLAC,23.67
215,366.74,349.21,392.88,312.98,"6801 ROCKLEDGE DR, BETHESDA, MD, US",386.61,Common Stock,0.931,35.15,936468,USA,USD,"Lockheed Martin Corporation is an American aerospace, defense, information security, and technology company with worldwide interests. It is headquartered in North Bethesda, Maryland, in the Washington, D.C., area.",21.71,2021-12-27,10.4,0.031,8777000000,21.71,11.06,1.531,2021-11-30,NYSE,December,12.25,8681000000,GUIDED MISSILES & SPACE VEHICLES & PARTS,,2021-09-30,93507994000,Lockheed Martin Corporation,,0.114,8.4,15.62,9.62,1.409,0.0913,-0.635,-0.028,0.0924,0.829,238.62,66347000000,MANUFACTURING,275786000,LMT,15.62
216,155.37,160.47,174.48,111.58,"30 PEMBROKE ROAD, EATON HOUSE, DUBLIN, IE",179.9,Common Stock,1.189,40.07,1551182,USA,USD,"Eaton Corporation plc is an American Irish-domiciled multinational power management company with 2020 sales of 17.86 billion USD, founded in the United States with corporate headquarters in Dublin, Ireland, and operational headquarters in Beachwood, Ohio.",5.15,2021-11-30,3.01,0.0177,3323000000,5.15,19.79,3.918,2021-11-10,NYSE,December,23.2,5450000000,MISC INDUSTRIAL & COMMERCIAL MACHINERY & EQUIPMENT,,2021-09-30,68619624000,Eaton Corporation plc,,0.125,1.748,33.41,4.241,3.516,0.106,0.414,0.088,0.0467,0.136,48.95,19517000000,TECHNOLOGY,398600000,ETN,33.41
217,135.86,137.26,146.29,99.41,"155 NORTH LAKE AVENUE, PASADENA, CA, US",155.77,Common Stock,0.847,47.22,52988,USA,USD,"Jacobs Engineering Group Inc. (NYSE: J) is an American international technical professional services firm. The company provides technical, professional and construction services, as well as scientific and specialty consulting for a broad range of clients globally, including companies, organizations, and government agencies.",3.503,2021-10-29,0.8,0.0055,1184020000,3.503,24.52,1.534,2021-10-14,NYSE,September,20.7,2588981000,HEAVY CONSTRUCTION OTHER THAN BLDG CONST - CONTRACTORS,,2021-06-30,18950261000,Jacobs Engineering Group Inc,,0.0688,1.399,41.51,3.063,1.351,0.0368,-0.558,0.097,0.0434,0.0678,107.73,14025833000,REAL ESTATE & CONSTRUCTION,130314000,J,41.51
218,43.51,43.37,46.29,32.99,"300 BOSTON SCIENTIFIC WAY, MARLBOROUGH, MA, US",51.2,Common Stock,0.829,11.55,885725,USA,USD,"Boston Scientific Corporation, doing business as Boston Scientific, is a manufacturer of medical devices used in interventional medical specialties, including interventional radiology, interventional cardiology, peripheral interventions, neuromodulation, neurovascular intervention, electrophysiology, cardiac surgery, vascular surgery, endoscopy, oncology, urology and gynecology.",0.769,None,None,0,3071000000,0.769,24.87,5.87,None,NYSE,December,22.68,6793000000,SURGICAL & MEDICAL INSTRUMENTS & APPARATUS,,2021-09-30,60170199000,Boston Scientific Corporation,,0.172,1.541,54.91,3.632,5.25,0.101,28.22,0.103,0.0394,0.0722,8.06,11470000000,LIFE SCIENCES,1424990000,BSX,54.91
219,3390.63,3366.62,3773.08,2881,"410 TERRY AVENUE NORTH, SEATTLE, WA, US",4066.41,Common Stock,1.114,237.8,1018724,USA,USD,"Amazon.com, Inc. is an American multinational technology company which focuses on e-commerce, cloud computing, digital streaming, and artificial intelligence. It is one of the Big Five companies in the U.S. information technology industry, along with Google, Apple, Microsoft, and Facebook. The company has been referred to as one of the most influential economic and cultural forces in the world, as well as the world's most valuable brand.",51.1,None,None,0,60403999000,51.1,27.7,3.922,None,NASDAQ,December,54.05,152757000000,RETAIL-CATALOG & MAIL-ORDER HOUSES,,2021-09-30,1784260854000,Amazon.com Inc,,0.0618,2.067,68.85,14.61,3.896,0.0574,-0.505,0.153,0.0532,0.258,909.11,457965011000,TRADE & SERVICES,507148000,AMZN,68.85
220,554.84,639.75,690.97,475.84,"100 WINCHESTER CIRCLE, ., LOS GATOS, CA, US",667.4,Common Stock,0.813,34.57,1065280,USA,USD,"Netflix, Inc. is an American over-the-top content platform and production company headquartered in Los Gatos, California. Netflix was founded in 1997 by Reed Hastings and Marc Randolph in Scotts Valley, California. The company's primary business is a subscription-based streaming service offering online streaming from a library of films and television series, including those produced in-house.",11.09,None,None,0,6693352000,11.09,16.2,10.45,None,NASDAQ,December,50.76,9719737000,SERVICES-VIDEO TAPE RENTAL,,2021-09-30,302363443000,Netflix Inc,,0.228,1.606,61.55,19.02,10.56,0.176,0.833,0.163,0.1,0.394,64.66,28632967000,TRADE & SERVICES,442952000,NFLX,61.55
221,483.96,514.05,565.74,362.45,"1320 RIDDER PARK DRIVE, SAN JOSE, CA, US",573.37,Common Stock,0.955,59.08,1730168,USA,USD,"Broadcom Inc. is an American designer, developer, manufacturer and global supplier of a wide range of semiconductor and infrastructure software products. Broadcom's product offerings serve the data center, networking, software, broadband, wireless, and storage and industrial markets.",13.49,2021-09-30,14.4,0.0259,13926000000,13.49,18.6,9.73,2021-09-21,NASDAQ,October,18.18,17370000000,SEMICONDUCTORS & RELATED DEVICES,,2021-07-31,231830356000,Broadcom Inc,,0.288,1.269,41.74,9.39,8.74,0.229,1.881,0.164,0.0616,0.253,64.97,26510000000,MANUFACTURING,411616000,AVGO,41.74
222,701.61,748.07,832.7,507.22,"1000 ALFRED NOBEL DRIVE, HERCULES, CA, US",918.75,Common Stock,0.87,512.48,12208,USA,USD,"Bio-Rad Laboratories, Inc. is an American developer and manufacturer of specialized technological products for the life science research and clinical diagnostics markets.",220.48,None,None,0,758890000,220.48,2.441,7.12,None,NYSE,December,49.26,1435922000,LABORATORY ANALYTICAL INSTRUMENTS,,2021-09-30,22464391000,Bio-Rad Laboratories Inc,,0.209,3.55,3.43,1.468,7.54,2.235,1.978,0.154,0.0243,0.551,99.96,2979615000,LIFE SCIENCES,24836100,BIO,3.43
223,226.97,209.18,270.48,188.45,"900 COTTAGE GROVE ROAD, BLOOMFIELD, CT, US",262.08,Common Stock,0.871,143.07,1739940,USA,USD,"Cigna is an American multinational managed healthcare and insurance company based in Bloomfield, Connecticut. Its insurance subsidiaries are major providers of medical, dental, disability, life and accident insurance and related products and services, the majority of which are offered through employers and other groups (e.g. governmental and non-governmental organizations, unions and associations).",24.03,2021-12-22,3,0.0138,10155000000,24.03,-,0.604,2021-12-06,NYSE,December,9.76,24356000000,HOSPITAL & MEDICAL SERVICE PLANS,,2021-09-30,72161821000,Cigna Corporation,,0.0485,0.872,9.06,1.522,0.423,0.0492,0.27,0.082,0.0329,0.176,493.03,170397008000,FINANCE,331428000,CI,9.06
224,67.51,72.55,77.57,40.12,"150 N RADNOR CHESTER RD, RADNOR, PA, US",76.09,Common Stock,2.141,113.76,59558,USA,USD,"Lincoln National Corporation is an American holding company, which operates multiple insurance and investment management businesses through subsidiary companies. Lincoln Financial Group is the marketing name for LNC and its subsidiary companies.",6.97,2022-02-01,1.68,0.0229,1917000000,6.97,-,0.923,2022-01-07,NYSE,December,6.48,3812000000,LIFE INSURANCE,,2021-09-30,13196275000,Lincoln National Corporation,,0.0992,1.24,10.47,0.626,0.704,0.0708,-0.165,-0.022,0.0032,0.0622,98.51,18763000000,FINANCE,180709000,LNC,10.47
225,50.78,53.6,59.56,40.63,"222 EAST ERIE STREET, STE 500, MILWAUKEE, WI, US",63.36,Common Stock,1.491,21.23,1699150,USA,USD,"Ingersoll Rand Inc., founded in 1859, is an American worldwide provider of industrial equipment, technologies and related parts and services to a broad and diverse customer base through a family of brands.",0.987,2021-12-17,2.12,0.0364,1163500000,0.987,22.6,4.28,2021-11-09,NYSE,December,25.77,1613400000,GENERAL INDUSTRIAL MACHINERY & EQUIPMENT,,2021-09-30,23823344000,Ingersoll Rand Inc,,0.11,1.63,59.22,2.744,4.045,0.0715,3.3,0.191,0.0265,0.0559,14.11,5889100000,TECHNOLOGY,407585000,IR,59.22
226,56.77,54.28,61.53,47.52,"ONE COMCAST CENTER, PHILADELPHIA, PA, US",65.49,Common Stock,0.968,20.96,1166691,USA,USD,"Comcast Corporation is an American telecommunications conglomerate headquartered in Philadelphia, Pennsylvania. It is the second-largest broadcasting and cable television company in the world by revenue (behind AT&T), the largest pay-TV company, the largest cable TV company and largest home Internet service provider in the United States, and the nation's third-largest home telephone service provider. Comcast provides services to U.S. residential and commercial customers in 40 states and in the District of Columbia. As the parent company of the international media company NBCUniversal since 2011, Comcast is a producer of feature films and television programs intended for theatrical exhibition and over-the-air and cable television broadcast, respectively.",3.109,2022-01-26,0.98,0.0183,33387999000,3.109,8.86,2.906,2022-01-04,NASDAQ,December,14.39,70443000000,CABLE & OTHER PAY TELEVISION SERVICES,,2021-09-30,244437221000,Comcast Corporation,,0.175,1.521,17.21,2.56,2.149,0.127,0.955,0.187,0.0456,0.153,24.78,113757004000,TECHNOLOGY,4559480000,CMCSA,17.21
227,130.59,139.39,155.98,90.3,"12800 TUCKAHOE CREEK PARKWAY, RICHMOND, VA, US",148.58,Common Stock,1.518,30.25,1170010,USA,USD,CarMax is a used vehicle retailer based in the United States. It operates two business segments: CarMax Sales Operations and CarMax Auto Finance.,7.04,None,None,0,1854125000,7.04,18.25,1.625,None,NYSE,February,20.92,2941935000,RETAIL-AUTO DEALERS & GASOLINE STATIONS,,2021-08-31,24182395000,CarMax Inc,,0.0588,1.296,21.19,5.01,0.887,0.0428,-0.039,0.471,0.0438,0.262,166.98,27248959000,TRADE & SERVICES,162113000,KMX,21.19
228,40.21,40.31,47.99,29.89,"1014 VINE ST, CINCINNATI, OH, US",42.53,Common Stock,0.432,12.47,56873,USA,USD,"The Kroger Company, or simply Kroger, is an American retail company founded by Bernard Kroger in 1883 in Cincinnati, Ohio.",1.495,2021-12-01,0.75,0.0178,5572000000,1.495,9.02,0.37,2021-11-12,NYSE,February,12.9,31789000000,RETAIL-GROCERY STORES,,2021-08-31,31552561000,The Kroger Co,,0.0202,4.091,28.38,3.388,0.236,0.0087,-0.408,0.039,0.0351,0.123,175.93,133439996000,TRADE & SERVICES,743638000,KR,28.38
229,199.42,207.16,227.81,167.31,"6555 STATE HIGHWAY 161, IRVING, TX, US",253.31,Common Stock,0.779,36.68,927653,USA,USD,"McKesson Corporation is an American company distributing pharmaceuticals and providing health information technology, medical supplies, and care management tools.",-30.59,2022-01-03,1.73,0.0078,4096000000,-30.59,8.79,0.159,2021-11-30,NYSE,March,11.48,11967000000,"WHOLESALE-DRUGS, PROPRIETARIES & DRUGGISTS' SUNDRIES",,2021-09-30,34321385000,McKesson Corporation,,0.0129,26.75,None,5.04,0.137,-0.0192,-0.517,0.095,0.0323,-1.27,1597.14,250991002000,TRADE & SERVICES,152682000,MCK,-
230,113.78,106.61,128.94,92.05,"PO BOX 511, 200 SOUTH WILCOX DRIVE, KINGSPORT, TN, US",130.19,Common Stock,1.538,45.52,915389,USA,USD,"Eastman Chemical Company is an American company primarily involved in the chemical industry. Once a subsidiary of Kodak, today it is an independent global specialty materials company that produces a broad range of advanced materials, chemicals and fibers for everyday purposes. The company is headquartered in Kingsport, Tennessee.",3.726,2021-10-01,2.76,0.024,1916000000,3.726,14.77,1.99,2021-09-14,NYSE,December,12.24,1983000000,"PLASTIC MATERIALS, SYNTH RESINS & NONVULCAN ELASTOMERS",,2021-09-30,15640749000,Eastman Chemical Company,,0.137,1.29,31.22,2.461,1.569,0.0513,1.178,0.282,0.053,0.0843,73.44,9968000000,LIFE SCIENCES,134440000,EMN,31.22
231,114.65,116.12,136.74,94.15,"7601 PENN AVE SOUTH, RICHFIELD, MN, US",131.3,Common Stock,1.587,17.53,764478,USA,USD,"Best Buy Co., Inc. is an American multinational consumer electronics retailer headquartered in Richfield, Minnesota.",9.77,2021-10-05,2.65,0.0199,4166000000,9.77,8.02,0.621,2021-09-13,NYSE,February,14.88,10596000000,"RETAIL-RADIO, TV & CONSUMER ELECTRONICS STORES",,2021-05-31,33400680000,Best Buy Co. Inc,,0.0633,2.115,13.89,7.54,0.639,0.0485,0.758,0.196,0.115,0.625,204.24,52275999000,TRADE & SERVICES,245964000,BBY,13.89
232,193.42,207.0,224.83,126.53,"5401 VIRGINIA WAY, BRENTWOOD, TN, US",223.22,Common Stock,0.937,17.73,916365,USA,USD,"Tractor Supply Company (TSCO) is an American retail chain of stores that offers products for home improvement, agriculture, lawn and garden maintenance, livestock, equine and pet care.",7.82,2021-12-08,1.96,0.009,1612583000,7.82,19.05,2.249,2021-11-19,NASDAQ,December,26.81,3761549000,"RETAIL-BUILDING MATERIALS, HARDWARE, GARDEN SUPPLY",,2021-09-30,25098484000,Tractor Supply Company,,0.111,2.78,28.2,12.31,2.042,0.0742,0.204,0.158,0.116,0.468,106.41,12290086000,TRADE & SERVICES,113815000,TSCO,28.2
233,266.03,288.83,310.26,176.71,"1099 AMERIPRISE FINANCIAL CENTER, MINNEAPOLIS, MN, US",333.78,Common Stock,1.647,50.77,820027,USA,USD,"Ameriprise Financial, Inc. is a diversified financial services company and bank holding company incorporated in Delaware and headquartered in Minneapolis, Minnesota. It provides financial planning products and services, including wealth management, asset management, insurance, annuities, and estate planning.",18.4,2021-11-19,4.34,0.0142,3619000000,18.4,-,2.438,2021-11-05,NYSE,December,12.56,5816000000,INVESTMENT ADVICE,,2021-09-30,34521420000,Ameriprise Financial Inc,,0.269,0.944,16.77,6.0,2.682,0.174,-0.775,-0.036,0.0132,0.38,108.29,12870000000,FINANCE,111890000,AMP,16.77
234,1678.15,1816.97,1958.55,1241.38,"610 NEWPORT CENTER DR, SUITE 1300, NEWPORT BEACH, CA, US",2008.21,Common Stock,1.254,82.08,1058090,USA,USD,"Chipotle Mexican Grill, Inc., often known simply as Chipotle, is an American chain of fast casual restaurants in the United States, United Kingdom, Canada, Germany, and France, specializing in tacos and Mission burritos that are made to order in front of the customer.",24.91,None,None,0,1040739000,24.91,44.48,7.45,None,NYSE,December,54.05,2071093000,RETAIL-EATING PLACES,,2021-09-30,52416250000,Chipotle Mexican Grill Inc,,0.11,1.5,74.8,22.11,7.29,0.0988,1.546,0.219,0.0808,0.345,256.01,7194138000,TRADE & SERVICES,28135400,CMG,74.8
235,61.96,60.36,65.21,52.06,"905 WEST FULTON MARKET, SUITE 200, CHICAGO, IL, US",70.48,Common Stock,0.7,19.86,1103982,USA,USD,"Mondelez International, Inc. is an American multinational confectionery, food, holding and beverage and snack food company based in Chicago, Illinois.",3.141,2021-10-14,1.295,0.0207,6192000000,3.141,18.4,3.687,2021-09-29,NASDAQ,December,20.24,10446000000,FOOD AND KINDRED PRODUCTS,,2021-09-30,87590167000,Mondelez International Inc,,0.178,3.35,19.99,3.159,3.088,0.157,0.141,0.078,0.0473,0.163,20.09,28359999000,MANUFACTURING,1394970000,MDLZ,19.99
236,385.38,400.74,426.16,214.53,"200 WEST STREET, NEW YORK, NY, US",453.84,Common Stock,1.532,275.26,886982,USA,USD,"The Goldman Sachs Group, Inc., is an American multinational investment bank and financial services company headquartered in New York City. It offers services in investment management, securities, asset management, prime brokerage, and securities underwriting. It also provides investment banking to institutional investors.",60.63,2021-12-30,5.75,0.0143,None,60.63,-,-,2021-12-01,NYSE,December,10.15,35974000000,"SECURITY BROKERS, DEALERS & FLOTATION COMPANIES",,2021-09-30,135561028000,The Goldman Sachs Group Inc,,0.48,1.814,6.68,1.398,2.332,0.382,0.662,0.279,0.0172,0.22,164.75,58134999000,FINANCE,334793000,GS,6.68
237,48.18,49.37,52.24,28.73,"777 LONG RIDGE ROAD, STAMFORD, CT, US",58.63,Common Stock,1.703,24.13,1601712,USA,USD,"Synchrony Financial is a consumer financial services company headquartered in Stamford, Connecticut, United States. The company offers consumer financing products, including credit, promotional financing and loyalty programs, installment lending to industries, and FDIC-insured consumer savings products through Synchrony Bank, its wholly owned online bank subsidiary.",7.07,2021-11-12,0.88,0.0177,None,7.07,-,-,2021-10-29,NYSE,December,8.61,5852000000,FINANCE SERVICES,,2021-09-30,27461458000,Synchrony Financial,,0.63,0.755,7.1,2.061,2.972,0.449,2.853,0.664,0.0442,0.319,16.04,9241000000,FINANCE,547259000,SYF,7.1
